[
{ "_id" : { "$oid" : "61bc2687e0feed58fd5f8afd" }, "isSent" : true, "time" : { "$date" : "2021-12-17T05:56:16.298+0000" }, "userId" : "606aea95a145ea2d26e0f1ab", "uid" : "61828b174e0a4c2b332c55d4", "textContent" : "New SMS", "__v" : 0 },
{ "_id" : { "$oid" : "61bc18431dc1f5574b0ff548" }, "isSent" : true, "time" : { "$date" : "2021-12-17T04:53:59.556+0000" }, "userId" : "606aea95a145ea2d26e0f1ab", "uid" : "61828b174e0a4c2b332c55d4", "textContent" : "Test", "__v" : 0 },
{ "_id" : { "$oid" : "61bc26253295be58e22be259" }, "isSent" : true, "time" : { "$date" : "2021-12-17T05:54:27.245+0000" }, "userId" : "606aea95a145ea2d26e0f1ab", "uid" : "61828b174e0a4c2b332c55d4", "textContent" : "Testing sms cmaplanner", "__v" : 0 },
{ "_id" : { "$oid" : "63e6767f6a9ab382a5838497" }, "userId" : "6394e22877a382e42b5302a9", "uid" : "63e675da120861af7aa7b35c", "textContent" : "hello", "isSent" : true, "isSeen" : false, "isRead" : true, "email" : "uctmasterfrank@gmail.com", "time" : "2/10/2023, 11:53:19 AM", "createdAt" : { "$date" : "2023-02-10T16:53:19.630+0000" }, "updatedAt" : { "$date" : "2023-04-28T12:20:58.874+0000" }, "__v" : 0 },
{ "_id" : { "$oid" : "63e676b46a9ab382a58384ad" }, "userId" : "6394e22877a382e42b5302a9", "uid" : "63e675da120861af7aa7b35c", "textContent" : "this is a text", "isSent" : true, "isSeen" : false, "isRead" : true, "email" : "uctmasterfrank@gmail.com", "time" : "2/10/2023, 11:54:12 AM", "createdAt" : { "$date" : "2023-02-10T16:54:12.859+0000" }, "updatedAt" : { "$date" : "2023-04-28T12:20:58.874+0000" }, "__v" : 0 },
{ "_id" : { "$oid" : "63f149fd512dc88705b4eb3c" }, "userId" : "6394e22877a382e42b5302a9", "uid" : "63e675da120861af7aa7b35c", "textContent" : "hello", "isSent" : true, "isSeen" : false, "isRead" : true, "email" : "uctmasterfrank@gmail.com", "time" : "2/18/2023, 4:58:21 PM", "createdAt" : { "$date" : "2023-02-18T21:58:21.078+0000" }, "updatedAt" : { "$date" : "2023-04-28T12:20:58.874+0000" }, "__v" : 0 },
{ "_id" : { "$oid" : "63f22d350d386edca1f77ffe" }, "userId" : "6394e22877a382e42b5302a9", "uid" : "63e675da120861af7aa7b35c", "textContent" : "asdfasdfasdfasdf", "isSent" : true, "isSeen" : false, "isRead" : true, "email" : "uctmasterfrank@gmail.com", "time" : "2/19/2023, 9:07:49 AM", "createdAt" : { "$date" : "2023-02-19T14:07:49.097+0000" }, "updatedAt" : { "$date" : "2023-04-28T12:20:58.874+0000" }, "__v" : 0 },
{ "_id" : { "$oid" : "63f22e420d386edca1f7804e" }, "userId" : "6394e22877a382e42b5302a9", "uid" : "63e675da120861af7aa7b35c", "textContent" : "Hello.", "isSent" : true, "isSeen" : false, "isRead" : true, "email" : "uctmasterfrank@gmail.com", "time" : "2/19/2023, 9:12:18 AM", "createdAt" : { "$date" : "2023-02-19T14:12:18.423+0000" }, "updatedAt" : { "$date" : "2023-04-28T12:20:58.874+0000" }, "__v" : 0 },
{ "_id" : { "$oid" : "63f22efc0d386edca1f78078" }, "userId" : "6394e22877a382e42b5302a9", "uid" : "63e675da120861af7aa7b35c", "textContent" : "Hi", "isSent" : true, "isSeen" : false, "isRead" : true, "email" : "uctmasterfrank@gmail.com", "time" : "2/19/2023, 9:15:24 AM", "createdAt" : { "$date" : "2023-02-19T14:15:24.505+0000" }, "updatedAt" : { "$date" : "2023-04-28T12:20:58.874+0000" }, "__v" : 0 },
{ "_id" : { "$oid" : "63f22f450d386edca1f780ab" }, "userId" : "6394e22877a382e42b5302a9", "uid" : "63e4e483c230b663594ec375", "textContent" : "sadffsafdwer", "isSent" : true, "isSeen" : false, "isRead" : true, "email" : "Ceo@clintonoh.com", "time" : "2/19/2023, 9:16:37 AM", "createdAt" : { "$date" : "2023-02-19T14:16:37.670+0000" }, "updatedAt" : { "$date" : "2023-04-27T02:56:19.570+0000" }, "__v" : 0 },
{ "_id" : { "$oid" : "63f22f470d386edca1f780b1" }, "userId" : "6394e22877a382e42b5302a9", "uid" : "63e4e483c230b663594ec375", "textContent" : "wreqerqwer", "isSent" : true, "isSeen" : false, "isRead" : true, "email" : "Ceo@clintonoh.com", "time" : "2/19/2023, 9:16:39 AM", "createdAt" : { "$date" : "2023-02-19T14:16:39.993+0000" }, "updatedAt" : { "$date" : "2023-04-27T02:56:19.570+0000" }, "__v" : 0 },
{ "_id" : { "$oid" : "63f22f490d386edca1f780b7" }, "userId" : "6394e22877a382e42b5302a9", "uid" : "63e4e483c230b663594ec375", "textContent" : "qwerqwerqr", "isSent" : true, "isSeen" : false, "isRead" : true, "email" : "Ceo@clintonoh.com", "time" : "2/19/2023, 9:16:41 AM", "createdAt" : { "$date" : "2023-02-19T14:16:41.558+0000" }, "updatedAt" : { "$date" : "2023-04-27T02:56:19.570+0000" }, "__v" : 0 },
{ "_id" : { "$oid" : "63f22f4c0d386edca1f780bd" }, "userId" : "6394e22877a382e42b5302a9", "uid" : "63e4e483c230b663594ec375", "textContent" : "sadfasfdasdfasdf", "isSent" : true, "isSeen" : false, "isRead" : true, "email" : "Ceo@clintonoh.com", "time" : "2/19/2023, 9:16:44 AM", "createdAt" : { "$date" : "2023-02-19T14:16:44.135+0000" }, "updatedAt" : { "$date" : "2023-04-27T02:56:19.570+0000" }, "__v" : 0 },
{ "_id" : { "$oid" : "63f22f720d386edca1f780e4" }, "userId" : "6394e22877a382e42b5302a9", "uid" : "63e675da120861af7aa7b35c", "textContent" : "asdfasdf", "isSent" : true, "isSeen" : false, "isRead" : true, "email" : "uctmasterfrank@gmail.com", "time" : "2/19/2023, 9:17:22 AM", "createdAt" : { "$date" : "2023-02-19T14:17:22.585+0000" }, "updatedAt" : { "$date" : "2023-04-28T12:20:58.874+0000" }, "__v" : 0 },
{ "_id" : { "$oid" : "63f22f740d386edca1f780ea" }, "userId" : "6394e22877a382e42b5302a9", "uid" : "63e675da120861af7aa7b35c", "textContent" : "qwerqerwqr", "isSent" : true, "isSeen" : false, "isRead" : true, "email" : "uctmasterfrank@gmail.com", "time" : "2/19/2023, 9:17:24 AM", "createdAt" : { "$date" : "2023-02-19T14:17:24.055+0000" }, "updatedAt" : { "$date" : "2023-04-28T12:20:58.874+0000" }, "__v" : 0 },
{ "_id" : { "$oid" : "63f22f9d0d386edca1f7812d" }, "userId" : "6394e22877a382e42b5302a9", "uid" : "63e675da120861af7aa7b35c", "textContent" : "asfdasdfd", "isSent" : true, "isSeen" : false, "isRead" : true, "email" : "uctmasterfrank@gmail.com", "time" : "2/19/2023, 9:18:05 AM", "createdAt" : { "$date" : "2023-02-19T14:18:05.415+0000" }, "updatedAt" : { "$date" : "2023-04-28T12:20:58.874+0000" }, "__v" : 0 },
{ "_id" : { "$oid" : "63f2325f0d386edca1f78187" }, "userId" : "6394e22877a382e42b5302a9", "uid" : "63e4e483c230b663594ec375", "textContent" : "sadfasdfasdf", "isSent" : true, "isSeen" : false, "isRead" : true, "email" : "Ceo@clintonoh.com", "time" : "2/19/2023, 9:29:51 AM", "createdAt" : { "$date" : "2023-02-19T14:29:51.959+0000" }, "updatedAt" : { "$date" : "2023-04-27T02:56:19.570+0000" }, "__v" : 0 },
{ "_id" : { "$oid" : "63f44f44cbeacd234b1ea1bc" }, "isSent" : true, "isSeen" : false, "isRead" : false, "time" : "2/20/2023, 11:57:40 PM", "createdAt" : { "$date" : "2023-02-21T04:57:40.803+0000" }, "updatedAt" : { "$date" : "2023-02-21T04:57:40.803+0000" }, "__v" : 0 },
{ "_id" : { "$oid" : "63f44fa3436a4e4cd118247e" }, "isSent" : true, "isSeen" : false, "isRead" : false, "time" : "2/20/2023, 11:59:15 PM", "createdAt" : { "$date" : "2023-02-21T04:59:15.222+0000" }, "updatedAt" : { "$date" : "2023-02-21T04:59:15.222+0000" }, "__v" : 0 },
{ "_id" : { "$oid" : "63f48f43c3968689bd1df6bd" }, "isSent" : true, "isSeen" : false, "isRead" : false, "time" : "2/21/2023, 4:30:43 AM", "createdAt" : { "$date" : "2023-02-21T09:30:43.082+0000" }, "updatedAt" : { "$date" : "2023-02-21T09:30:43.082+0000" }, "__v" : 0 },
{ "_id" : { "$oid" : "63f83dfbb535a7e0062d0ff9" }, "userId" : "6394e22877a382e42b5302a9", "uid" : "63f83dc8b535a7e0062d0fb6", "textContent" : "hi", "isSent" : true, "isSeen" : false, "isRead" : true, "email" : "bisharat.akram1999@gmail.com", "time" : "2/23/2023, 11:32:59 PM", "createdAt" : { "$date" : "2023-02-24T04:32:59.410+0000" }, "updatedAt" : { "$date" : "2023-04-27T02:56:19.938+0000" }, "__v" : 0 },
{ "_id" : { "$oid" : "63f8407ab535a7e0062d0fff" }, "userId" : "6394e22877a382e42b5302a9", "uid" : "63f83dc8b535a7e0062d0fb6", "textContent" : "Hello from prod", "isSent" : true, "isSeen" : false, "isRead" : true, "email" : "bisharat.akram1999@gmail.com", "time" : "2/23/2023, 11:43:38 PM", "createdAt" : { "$date" : "2023-02-24T04:43:38.368+0000" }, "updatedAt" : { "$date" : "2023-04-27T02:56:19.938+0000" }, "__v" : 0 },
{ "_id" : { "$oid" : "63f990b8996f1d228d2e48f9" }, "userId" : "6394e22877a382e42b5302a9", "uid" : "63f83dc8b535a7e0062d0fb6", "textContent" : "Hi", "isSent" : true, "isSeen" : false, "isRead" : true, "email" : "bisharat.akram1999@gmail.com", "time" : "2/24/2023, 11:38:16 PM", "createdAt" : { "$date" : "2023-02-25T04:38:16.116+0000" }, "updatedAt" : { "$date" : "2023-04-27T02:56:19.938+0000" }, "__v" : 0 },
{ "_id" : { "$oid" : "63f99af1996f1d228d2e4a79" }, "userId" : "6394e22877a382e42b5302a9", "uid" : "63f83dc8b535a7e0062d0fb6", "textContent" : "hlo", "isSent" : true, "isSeen" : false, "isRead" : true, "email" : "bisharat.akram1999@gmail.com", "time" : "2/25/2023, 12:21:53 AM", "createdAt" : { "$date" : "2023-02-25T05:21:53.768+0000" }, "updatedAt" : { "$date" : "2023-04-27T02:56:19.938+0000" }, "__v" : 0 },
{ "_id" : { "$oid" : "63fe16878693fe043324daf9" }, "userId" : "6394e22877a382e42b5302a9", "uid" : "63f83dc8b535a7e0062d0fb6", "textContent" : "hi from live", "isSent" : true, "isSeen" : false, "isRead" : true, "email" : "bisharat.akram1999@gmail.com", "time" : "2/28/2023, 9:58:15 AM", "createdAt" : { "$date" : "2023-02-28T14:58:15.268+0000" }, "updatedAt" : { "$date" : "2023-04-27T02:56:19.938+0000" }, "__v" : 0 },
{ "_id" : { "$oid" : "63fe16918693fe043324db01" }, "userId" : "6394e22877a382e42b5302a9", "uid" : "63f83dc8b535a7e0062d0fb6", "textContent" : "hello to live", "isSent" : false, "isSeen" : false, "isRead" : true, "email" : "bisharat.akram1999@gmail.com", "time" : "2/28/2023, 9:58:25 AM", "createdAt" : { "$date" : "2023-02-28T14:58:25.458+0000" }, "updatedAt" : { "$date" : "2023-04-27T02:56:19.938+0000" }, "__v" : 0 },
{ "_id" : { "$oid" : "63fe16a98693fe043324db26" }, "userId" : "6394e22877a382e42b5302a9", "uid" : "63f83dc8b535a7e0062d0fb6", "textContent" : "hello demo", "isSent" : false, "isSeen" : false, "isRead" : true, "email" : "bisharat.akram1999@gmail.com", "time" : "2/28/2023, 9:58:49 AM", "createdAt" : { "$date" : "2023-02-28T14:58:49.361+0000" }, "updatedAt" : { "$date" : "2023-04-27T02:56:19.938+0000" }, "__v" : 0 },
{ "_id" : { "$oid" : "63fe16b78693fe043324db53" }, "userId" : "6394e22877a382e42b5302a9", "uid" : "63f83dc8b535a7e0062d0fb6", "textContent" : "hi", "isSent" : true, "isSeen" : false, "isRead" : true, "email" : "bisharat.akram1999@gmail.com", "time" : "2/28/2023, 9:59:03 AM", "createdAt" : { "$date" : "2023-02-28T14:59:03.908+0000" }, "updatedAt" : { "$date" : "2023-04-27T02:56:19.938+0000" }, "__v" : 0 },
{ "_id" : { "$oid" : "63fe16c18693fe043324db5f" }, "userId" : "6394e22877a382e42b5302a9", "uid" : "63f83dc8b535a7e0062d0fb6", "textContent" : "hi back", "isSent" : false, "isSeen" : false, "isRead" : true, "email" : "bisharat.akram1999@gmail.com", "time" : "2/28/2023, 9:59:13 AM", "createdAt" : { "$date" : "2023-02-28T14:59:13.014+0000" }, "updatedAt" : { "$date" : "2023-04-27T02:56:19.938+0000" }, "__v" : 0 },
{ "_id" : { "$oid" : "63fe1ab58693fe043324e4c7" }, "userId" : "6394e22877a382e42b5302a9", "uid" : "63e675da120861af7aa7b35c", "textContent" : "hello", "isSent" : true, "isSeen" : false, "isRead" : true, "email" : "uctmasterfrank@gmail.com", "time" : "2/28/2023, 10:16:05 AM", "createdAt" : { "$date" : "2023-02-28T15:16:05.044+0000" }, "updatedAt" : { "$date" : "2023-04-28T12:20:58.874+0000" }, "__v" : 0 },
{ "_id" : { "$oid" : "63fe1eea5065df06f32cc9df" }, "userId" : "6394e22877a382e42b5302a9", "uid" : "63e675da120861af7aa7b35c", "textContent" : "xfdhfdg", "isSent" : true, "isSeen" : false, "isRead" : true, "email" : "uctmasterfrank@gmail.com", "time" : "2/28/2023, 10:34:02 AM", "createdAt" : { "$date" : "2023-02-28T15:34:02.377+0000" }, "updatedAt" : { "$date" : "2023-04-28T12:20:58.874+0000" }, "__v" : 0 },
{ "_id" : { "$oid" : "63fe1ffe9df9d87f6bab23d7" }, "userId" : "6394e22877a382e42b5302a9", "uid" : "63e675da120861af7aa7b35c", "textContent" : "😀", "isSent" : true, "isSeen" : false, "isRead" : true, "email" : "uctmasterfrank@gmail.com", "time" : "2/28/2023, 10:38:38 AM", "createdAt" : { "$date" : "2023-02-28T15:38:38.404+0000" }, "updatedAt" : { "$date" : "2023-04-28T12:20:58.874+0000" }, "__v" : 0 },
{ "_id" : { "$oid" : "63fe272b9df9d87f6bab2d2a" }, "userId" : "6394e22877a382e42b5302a9", "uid" : "63f83dc8b535a7e0062d0fb6", "textContent" : "hi", "isSent" : true, "isSeen" : false, "isRead" : true, "email" : "bisharat.akram1999@gmail.com", "time" : "2/28/2023, 11:09:15 AM", "createdAt" : { "$date" : "2023-02-28T16:09:15.488+0000" }, "updatedAt" : { "$date" : "2023-04-27T02:56:19.938+0000" }, "__v" : 0 },
{ "_id" : { "$oid" : "63fe27379df9d87f6bab2d32" }, "userId" : "6394e22877a382e42b5302a9", "uid" : "63f83dc8b535a7e0062d0fb6", "textContent" : "hello from client", "isSent" : false, "isSeen" : false, "isRead" : true, "email" : "bisharat.akram1999@gmail.com", "time" : "2/28/2023, 11:09:27 AM", "createdAt" : { "$date" : "2023-02-28T16:09:27.950+0000" }, "updatedAt" : { "$date" : "2023-04-27T02:56:19.938+0000" }, "__v" : 0 },
{ "_id" : { "$oid" : "63fe27609df9d87f6bab2d4d" }, "userId" : "6394e22877a382e42b5302a9", "uid" : "63f83dc8b535a7e0062d0fb6", "textContent" : "😙", "isSent" : true, "isSeen" : false, "isRead" : true, "email" : "bisharat.akram1999@gmail.com", "time" : "2/28/2023, 11:10:08 AM", "createdAt" : { "$date" : "2023-02-28T16:10:08.331+0000" }, "updatedAt" : { "$date" : "2023-04-27T02:56:19.938+0000" }, "__v" : 0 },
{ "_id" : { "$oid" : "640239d8ed47ecfdd6817608" }, "userId" : "6394e22877a382e42b5302a9", "uid" : "6402399fed47ecfdd68174cc", "textContent" : "Hello", "isSent" : true, "isSeen" : false, "isRead" : true, "email" : "ceo@gmail.com", "time" : "3/3/2023, 1:18:00 PM", "createdAt" : { "$date" : "2023-03-03T18:18:00.642+0000" }, "updatedAt" : { "$date" : "2023-04-27T02:55:46.770+0000" }, "__v" : 0 },
{ "_id" : { "$oid" : "64023cb2ed47ecfdd6817795" }, "userId" : "6394e22877a382e42b5302a9", "uid" : "63f0d24d74402c6dfa121ee9", "textContent" : "Hi", "isSent" : false, "isSeen" : false, "isRead" : false, "email" : "ceo@clintonoh.com", "time" : "3/3/2023, 1:30:10 PM", "createdAt" : { "$date" : "2023-03-03T18:30:10.513+0000" }, "updatedAt" : { "$date" : "2023-03-03T18:30:10.513+0000" }, "__v" : 0 },
{ "_id" : { "$oid" : "64023cb6ed47ecfdd68177af" }, "userId" : "6394e22877a382e42b5302a9", "uid" : "63f0d24d74402c6dfa121ee9", "textContent" : "Do you see this", "isSent" : false, "isSeen" : false, "isRead" : false, "email" : "ceo@clintonoh.com", "time" : "3/3/2023, 1:30:14 PM", "createdAt" : { "$date" : "2023-03-03T18:30:14.703+0000" }, "updatedAt" : { "$date" : "2023-03-03T18:30:14.703+0000" }, "__v" : 0 },
{ "_id" : { "$oid" : "640241ebed47ecfdd68180db" }, "userId" : "6394e22877a382e42b5302a9", "uid" : "63f83dc8b535a7e0062d0fb6", "textContent" : "hi", "isSent" : false, "isSeen" : false, "isRead" : true, "email" : "bisharat.akram1999@gmail.com", "time" : "3/3/2023, 1:52:27 PM", "createdAt" : { "$date" : "2023-03-03T18:52:27.615+0000" }, "updatedAt" : { "$date" : "2023-04-27T02:56:19.938+0000" }, "__v" : 0 },
{ "_id" : { "$oid" : "64024219ed47ecfdd68181d0" }, "userId" : "6394e22877a382e42b5302a9", "uid" : "63f83dc8b535a7e0062d0fb6", "textContent" : "hlo", "isSent" : false, "isSeen" : false, "isRead" : true, "email" : "bisharat.akram1999@gmail.com", "time" : "3/3/2023, 1:53:13 PM", "createdAt" : { "$date" : "2023-03-03T18:53:13.934+0000" }, "updatedAt" : { "$date" : "2023-04-27T02:56:19.938+0000" }, "__v" : 0 },
{ "_id" : { "$oid" : "6402579aed47ecfdd681876e" }, "userId" : "6394e22877a382e42b5302a9", "uid" : "63f83dc8b535a7e0062d0fb6", "textContent" : "hi", "isSent" : true, "isSeen" : false, "isRead" : true, "email" : "bisharat.akram1999@gmail.com", "time" : "3/3/2023, 3:24:58 PM", "createdAt" : { "$date" : "2023-03-03T20:24:58.229+0000" }, "updatedAt" : { "$date" : "2023-04-27T02:56:19.938+0000" }, "__v" : 0 },
{ "_id" : { "$oid" : "640257aded47ecfdd6818776" }, "userId" : "6394e22877a382e42b5302a9", "uid" : "63f83dc8b535a7e0062d0fb6", "textContent" : "hlo", "isSent" : false, "isSeen" : false, "isRead" : true, "email" : "bisharat.akram1999@gmail.com", "time" : "3/3/2023, 3:25:17 PM", "createdAt" : { "$date" : "2023-03-03T20:25:17.358+0000" }, "updatedAt" : { "$date" : "2023-04-27T02:56:19.938+0000" }, "__v" : 0 },
{ "_id" : { "$oid" : "64025b57ed47ecfdd68191aa" }, "userId" : "6394e22877a382e42b5302a9", "uid" : "63f83dc8b535a7e0062d0fb6", "textContent" : "hlo", "isSent" : true, "isSeen" : false, "isRead" : true, "email" : "bisharat.akram1999@gmail.com", "time" : "3/3/2023, 3:40:55 PM", "createdAt" : { "$date" : "2023-03-03T20:40:55.655+0000" }, "updatedAt" : { "$date" : "2023-04-27T02:56:19.938+0000" }, "__v" : 0 },
{ "_id" : { "$oid" : "64025b61ed47ecfdd68191b2" }, "userId" : "6394e22877a382e42b5302a9", "uid" : "63f83dc8b535a7e0062d0fb6", "textContent" : "this is response", "isSent" : false, "isSeen" : false, "isRead" : true, "email" : "bisharat.akram1999@gmail.com", "time" : "3/3/2023, 3:41:05 PM", "createdAt" : { "$date" : "2023-03-03T20:41:05.189+0000" }, "updatedAt" : { "$date" : "2023-04-27T02:56:19.938+0000" }, "__v" : 0 },
{ "_id" : { "$oid" : "640344910be1f0b5bcbfd97a" }, "userId" : "6394e22877a382e42b5302a9", "uid" : "63f83dc8b535a7e0062d0fb6", "textContent" : "hello", "isSent" : true, "isSeen" : false, "isRead" : true, "email" : "bisharat.akram1999@gmail.com", "time" : "3/4/2023, 8:16:01 AM", "createdAt" : { "$date" : "2023-03-04T13:16:01.020+0000" }, "updatedAt" : { "$date" : "2023-04-27T02:56:19.938+0000" }, "__v" : 0 },
{ "_id" : { "$oid" : "640344980be1f0b5bcbfd982" }, "userId" : "6394e22877a382e42b5302a9", "uid" : "63f83dc8b535a7e0062d0fb6", "textContent" : "from receiver", "isSent" : false, "isSeen" : false, "isRead" : true, "email" : "bisharat.akram1999@gmail.com", "time" : "3/4/2023, 8:16:08 AM", "createdAt" : { "$date" : "2023-03-04T13:16:08.719+0000" }, "updatedAt" : { "$date" : "2023-04-27T02:56:19.938+0000" }, "__v" : 0 },
{ "_id" : { "$oid" : "640345ae0be1f0b5bcbfda60" }, "userId" : "6394e22877a382e42b5302a9", "uid" : "6402399fed47ecfdd68174cc", "textContent" : "Kindly reply to this message.", "isSent" : true, "isSeen" : false, "isRead" : true, "email" : "ceo@gmail.com", "time" : "3/4/2023, 8:20:46 AM", "createdAt" : { "$date" : "2023-03-04T13:20:46.323+0000" }, "updatedAt" : { "$date" : "2023-04-27T02:55:46.770+0000" }, "__v" : 0 },
{ "_id" : { "$oid" : "640345de0be1f0b5bcbfda68" }, "userId" : "6394e22877a382e42b5302a9", "uid" : "63f83dc8b535a7e0062d0fb6", "textContent" : "hi", "isSent" : false, "isSeen" : false, "isRead" : true, "email" : "bisharat.akram1999@gmail.com", "time" : "3/4/2023, 8:21:34 AM", "createdAt" : { "$date" : "2023-03-04T13:21:34.918+0000" }, "updatedAt" : { "$date" : "2023-04-27T02:56:19.938+0000" }, "__v" : 0 },
{ "_id" : { "$oid" : "640346570be1f0b5bcbfda72" }, "userId" : "6394e22877a382e42b5302a9", "uid" : "63f0d24d74402c6dfa121ee9", "textContent" : "Test ", "isSent" : false, "isSeen" : false, "isRead" : false, "email" : "ceo@clintonoh.com", "time" : "3/4/2023, 8:23:35 AM", "createdAt" : { "$date" : "2023-03-04T13:23:35.363+0000" }, "updatedAt" : { "$date" : "2023-03-04T13:23:35.363+0000" }, "__v" : 0 },
{ "_id" : { "$oid" : "640348120be1f0b5bcbfdbf3" }, "userId" : "6394e22877a382e42b5302a9", "uid" : "63f83dc8b535a7e0062d0fb6", "textContent" : "from receiver", "isSent" : false, "isSeen" : false, "isRead" : true, "email" : "bisharat.akram1999@gmail.com", "time" : "3/4/2023, 8:30:58 AM", "createdAt" : { "$date" : "2023-03-04T13:30:58.775+0000" }, "updatedAt" : { "$date" : "2023-04-27T02:56:19.938+0000" }, "__v" : 0 },
{ "_id" : { "$oid" : "64034dff0be1f0b5bcbfdf11" }, "userId" : "6394e22877a382e42b5302a9", "uid" : "63f83dc8b535a7e0062d0fb6", "textContent" : "from receiver", "isSent" : false, "isSeen" : false, "isRead" : true, "email" : "bisharat.akram1999@gmail.com", "time" : "3/4/2023, 8:56:15 AM", "createdAt" : { "$date" : "2023-03-04T13:56:15.976+0000" }, "updatedAt" : { "$date" : "2023-04-27T02:56:19.938+0000" }, "__v" : 0 },
{ "_id" : { "$oid" : "640354bb0be1f0b5bcbfdfa2" }, "userId" : "6394e22877a382e42b5302a9", "uid" : "63f83dc8b535a7e0062d0fb6", "textContent" : "hlo", "isSent" : true, "isSeen" : false, "isRead" : true, "email" : "bisharat.akram1999@gmail.com", "time" : "3/4/2023, 9:24:59 AM", "createdAt" : { "$date" : "2023-03-04T14:24:59.105+0000" }, "updatedAt" : { "$date" : "2023-04-27T02:56:19.938+0000" }, "__v" : 0 },
{ "_id" : { "$oid" : "640355050be1f0b5bcbfdfa9" }, "userId" : "6394e22877a382e42b5302a9", "uid" : "63f83dc8b535a7e0062d0fb6", "textContent" : "hlo", "isSent" : true, "isSeen" : false, "isRead" : true, "email" : "bisharat.akram1999@gmail.com", "time" : "3/4/2023, 9:26:13 AM", "createdAt" : { "$date" : "2023-03-04T14:26:13.227+0000" }, "updatedAt" : { "$date" : "2023-04-27T02:56:19.938+0000" }, "__v" : 0 },
{ "_id" : { "$oid" : "640355140be1f0b5bcbfdfb1" }, "userId" : "6394e22877a382e42b5302a9", "uid" : "63f83dc8b535a7e0062d0fb6", "textContent" : "hi", "isSent" : false, "isSeen" : false, "isRead" : true, "email" : "bisharat.akram1999@gmail.com", "time" : "3/4/2023, 9:26:28 AM", "createdAt" : { "$date" : "2023-03-04T14:26:28.979+0000" }, "updatedAt" : { "$date" : "2023-04-27T02:56:19.938+0000" }, "__v" : 0 },
{ "_id" : { "$oid" : "6404a4168fa99325224a8b54" }, "userId" : "6394e22877a382e42b5302a9", "uid" : "6402399fed47ecfdd68174cc", "textContent" : "hi", "isSent" : true, "isSeen" : false, "isRead" : true, "email" : "ceo@gmail.com", "time" : "3/5/2023, 9:15:50 AM", "createdAt" : { "$date" : "2023-03-05T14:15:50.890+0000" }, "updatedAt" : { "$date" : "2023-04-27T02:55:46.770+0000" }, "__v" : 0 },
{ "_id" : { "$oid" : "6404a4248fa99325224a8b5c" }, "userId" : "6394e22877a382e42b5302a9", "uid" : "63f0d24d74402c6dfa121ee9", "textContent" : "Who is this ", "isSent" : false, "isSeen" : false, "isRead" : false, "email" : "ceo@clintonoh.com", "time" : "3/5/2023, 9:16:04 AM", "createdAt" : { "$date" : "2023-03-05T14:16:04.241+0000" }, "updatedAt" : { "$date" : "2023-03-05T14:16:04.241+0000" }, "__v" : 0 },
{ "_id" : { "$oid" : "6405042bc0cbf95d8f03a57d" }, "userId" : "6394e22877a382e42b5302a9", "uid" : "6402399fed47ecfdd68174cc", "textContent" : "Who is this ", "isSent" : false, "isSeen" : false, "isRead" : true, "email" : "ceo@clintonoh.com", "time" : "3/5/2023, 4:05:47 PM", "createdAt" : { "$date" : "2023-03-05T21:05:47.024+0000" }, "updatedAt" : { "$date" : "2023-04-27T02:55:46.770+0000" }, "__v" : 0 },
{ "_id" : { "$oid" : "6405723a89e04c9e74663f15" }, "userId" : "6394e22877a382e42b5302a9", "uid" : "63f0d24d74402c6dfa121ee9", "textContent" : "Who is this ", "isSent" : false, "isSeen" : false, "isRead" : false, "email" : "ceo@clintonoh.com", "time" : "3/5/2023, 11:55:22 PM", "createdAt" : { "$date" : "2023-03-06T04:55:22.297+0000" }, "updatedAt" : { "$date" : "2023-03-06T04:55:22.297+0000" }, "__v" : 0 },
{ "_id" : { "$oid" : "64061075758e5a76f19bb94d" }, "userId" : "6394e22877a382e42b5302a9", "uid" : "63f0d24d74402c6dfa121ee9", "textContent" : "Who is this ", "isSent" : false, "isSeen" : false, "isRead" : false, "email" : "ceo@clintonoh.com", "time" : "3/6/2023, 11:10:29 AM", "createdAt" : { "$date" : "2023-03-06T16:10:29.670+0000" }, "updatedAt" : { "$date" : "2023-03-06T16:10:29.670+0000" }, "__v" : 0 },
{ "_id" : { "$oid" : "640633536d6302f707512e3d" }, "userId" : "6394e22877a382e42b5302a9", "uid" : "6402399fed47ecfdd68174cc", "textContent" : "Who is this ", "isSent" : false, "isSeen" : false, "isRead" : true, "email" : "ceo@gmail.com", "time" : "3/6/2023, 1:39:15 PM", "createdAt" : { "$date" : "2023-03-06T18:39:15.403+0000" }, "updatedAt" : { "$date" : "2023-04-27T02:55:46.770+0000" }, "__v" : 0 },
{ "_id" : { "$oid" : "640633926d6302f707512edb" }, "userId" : "6394e22877a382e42b5302a9", "uid" : "6402399fed47ecfdd68174cc", "textContent" : "hello", "isSent" : true, "isSeen" : false, "isRead" : true, "email" : "ceo@gmail.com", "time" : "3/6/2023, 1:40:18 PM", "createdAt" : { "$date" : "2023-03-06T18:40:18.131+0000" }, "updatedAt" : { "$date" : "2023-04-27T02:55:46.770+0000" }, "__v" : 0 },
{ "_id" : { "$oid" : "6406339c6d6302f707512ee2" }, "userId" : "6394e22877a382e42b5302a9", "uid" : "6402399fed47ecfdd68174cc", "textContent" : "clinton can you please reply to this message.", "isSent" : true, "isSeen" : false, "isRead" : true, "email" : "ceo@gmail.com", "time" : "3/6/2023, 1:40:28 PM", "createdAt" : { "$date" : "2023-03-06T18:40:28.175+0000" }, "updatedAt" : { "$date" : "2023-04-27T02:55:46.770+0000" }, "__v" : 0 },
{ "_id" : { "$oid" : "640633bd6d6302f707512eea" }, "userId" : "6394e22877a382e42b5302a9", "uid" : "6402399fed47ecfdd68174cc", "textContent" : "Who is this ", "isSent" : false, "isSeen" : false, "isRead" : true, "email" : "ceo@gmail.com", "time" : "3/6/2023, 1:41:01 PM", "createdAt" : { "$date" : "2023-03-06T18:41:01.328+0000" }, "updatedAt" : { "$date" : "2023-04-27T02:55:46.770+0000" }, "__v" : 0 },
{ "_id" : { "$oid" : "6406341b6d6302f707512efa" }, "userId" : "6394e22877a382e42b5302a9", "uid" : "6402399fed47ecfdd68174cc", "textContent" : "Who is this ", "isSent" : false, "isSeen" : false, "isRead" : true, "email" : "ceo@gmail.com", "time" : "3/6/2023, 1:42:35 PM", "createdAt" : { "$date" : "2023-03-06T18:42:35.444+0000" }, "updatedAt" : { "$date" : "2023-04-27T02:55:46.770+0000" }, "__v" : 0 },
{ "_id" : { "$oid" : "6406351c6d6302f707512ff8" }, "userId" : "6394e22877a382e42b5302a9", "uid" : "6402399fed47ecfdd68174cc", "textContent" : "Who is this ", "isSent" : false, "isSeen" : false, "isRead" : true, "email" : "ceo@gmail.com", "time" : "3/6/2023, 1:46:52 PM", "createdAt" : { "$date" : "2023-03-06T18:46:52.905+0000" }, "updatedAt" : { "$date" : "2023-04-27T02:55:46.770+0000" }, "__v" : 0 },
{ "_id" : { "$oid" : "640635666d6302f707513030" }, "userId" : "6394e22877a382e42b5302a9", "uid" : "6402399fed47ecfdd68174cc", "textContent" : "Hello", "isSent" : false, "isSeen" : false, "isRead" : true, "email" : "ceo@gmail.com", "time" : "3/6/2023, 1:48:06 PM", "createdAt" : { "$date" : "2023-03-06T18:48:06.118+0000" }, "updatedAt" : { "$date" : "2023-04-27T02:55:46.770+0000" }, "__v" : 0 },
{ "_id" : { "$oid" : "6406356e6d6302f7075130b0" }, "userId" : "6394e22877a382e42b5302a9", "uid" : "6402399fed47ecfdd68174cc", "textContent" : "🔥 emoji", "isSent" : false, "isSeen" : false, "isRead" : true, "email" : "ceo@gmail.com", "time" : "3/6/2023, 1:48:14 PM", "createdAt" : { "$date" : "2023-03-06T18:48:14.756+0000" }, "updatedAt" : { "$date" : "2023-04-27T02:55:46.770+0000" }, "__v" : 0 },
{ "_id" : { "$oid" : "640635926d6302f7075130b9" }, "userId" : "6394e22877a382e42b5302a9", "uid" : "6402399fed47ecfdd68174cc", "textContent" : "kindly reply to this message asap i have to check it in real time.", "isSent" : true, "isSeen" : false, "isRead" : true, "email" : "ceo@gmail.com", "time" : "3/6/2023, 1:48:50 PM", "createdAt" : { "$date" : "2023-03-06T18:48:50.625+0000" }, "updatedAt" : { "$date" : "2023-04-27T02:55:46.770+0000" }, "__v" : 0 },
{ "_id" : { "$oid" : "64063b996d6302f7075131cb" }, "userId" : "6394e22877a382e42b5302a9", "uid" : "6402399fed47ecfdd68174cc", "textContent" : "Hi", "isSent" : false, "isSeen" : false, "isRead" : true, "email" : "ceo@gmail.com", "time" : "3/6/2023, 2:14:33 PM", "createdAt" : { "$date" : "2023-03-06T19:14:33.984+0000" }, "updatedAt" : { "$date" : "2023-04-27T02:55:46.770+0000" }, "__v" : 0 },
{ "_id" : { "$oid" : "640652676d6302f707513426" }, "userId" : "6394e22877a382e42b5302a9", "uid" : "6402399fed47ecfdd68174cc", "textContent" : "Ji", "isSent" : false, "isSeen" : false, "isRead" : true, "email" : "ceo@gmail.com", "time" : "3/6/2023, 3:51:51 PM", "createdAt" : { "$date" : "2023-03-06T20:51:51.585+0000" }, "updatedAt" : { "$date" : "2023-04-27T02:55:46.770+0000" }, "__v" : 0 },
{ "_id" : { "$oid" : "6406933b6d6302f707517833" }, "userId" : "6394e22877a382e42b5302a9", "uid" : "6402399fed47ecfdd68174cc", "textContent" : "Hello", "isSent" : false, "isSeen" : false, "isRead" : true, "email" : "ceo@gmail.com", "time" : "3/6/2023, 8:28:27 PM", "createdAt" : { "$date" : "2023-03-07T01:28:27.761+0000" }, "updatedAt" : { "$date" : "2023-04-27T02:55:46.770+0000" }, "__v" : 0 },
{ "_id" : { "$oid" : "6406934b6d6302f70751783f" }, "userId" : "6394e22877a382e42b5302a9", "uid" : "6402399fed47ecfdd68174cc", "textContent" : "🔥", "isSent" : false, "isSeen" : false, "isRead" : true, "email" : "ceo@gmail.com", "time" : "3/6/2023, 8:28:43 PM", "createdAt" : { "$date" : "2023-03-07T01:28:43.929+0000" }, "updatedAt" : { "$date" : "2023-04-27T02:55:46.770+0000" }, "__v" : 0 },
{ "_id" : { "$oid" : "6406935a6d6302f707517849" }, "userId" : "6394e22877a382e42b5302a9", "uid" : "6402399fed47ecfdd68174cc", "textContent" : "🔥", "isSent" : false, "isSeen" : false, "isRead" : true, "email" : "ceo@gmail.com", "time" : "3/6/2023, 8:28:58 PM", "createdAt" : { "$date" : "2023-03-07T01:28:58.239+0000" }, "updatedAt" : { "$date" : "2023-04-27T02:55:46.770+0000" }, "__v" : 0 },
{ "_id" : { "$oid" : "6406936d6d6302f70751785f" }, "userId" : "6394e22877a382e42b5302a9", "uid" : "6402399fed47ecfdd68174cc", "textContent" : "🔥", "isSent" : false, "isSeen" : false, "isRead" : true, "email" : "ceo@gmail.com", "time" : "3/6/2023, 8:29:17 PM", "createdAt" : { "$date" : "2023-03-07T01:29:17.888+0000" }, "updatedAt" : { "$date" : "2023-04-27T02:55:46.770+0000" }, "__v" : 0 },
{ "_id" : { "$oid" : "6406937d6d6302f707517870" }, "userId" : "6394e22877a382e42b5302a9", "uid" : "6402399fed47ecfdd68174cc", "textContent" : "Hello", "isSent" : true, "isSeen" : false, "isRead" : true, "email" : "ceo@gmail.com", "time" : "3/6/2023, 8:29:33 PM", "createdAt" : { "$date" : "2023-03-07T01:29:33.943+0000" }, "updatedAt" : { "$date" : "2023-04-27T02:55:46.770+0000" }, "__v" : 0 },
{ "_id" : { "$oid" : "640693d16d6302f70751795b" }, "userId" : "6394e22877a382e42b5302a9", "uid" : "6402399fed47ecfdd68174cc", "textContent" : "Test", "isSent" : false, "isSeen" : false, "isRead" : true, "email" : "ceo@gmail.com", "time" : "3/6/2023, 8:30:57 PM", "createdAt" : { "$date" : "2023-03-07T01:30:57.199+0000" }, "updatedAt" : { "$date" : "2023-04-27T02:55:46.770+0000" }, "__v" : 0 },
{ "_id" : { "$oid" : "640750a707321a02d2aad2f9" }, "userId" : "6394e22877a382e42b5302a9", "uid" : "63e675da120861af7aa7b35c", "textContent" : "text check", "isSent" : true, "isSeen" : false, "isRead" : true, "email" : "uctmasterfrank@gmail.com", "time" : "3/7/2023, 9:56:39 AM", "createdAt" : { "$date" : "2023-03-07T14:56:39.512+0000" }, "updatedAt" : { "$date" : "2023-04-28T12:20:58.874+0000" }, "__v" : 0 },
{ "_id" : { "$oid" : "64093a78f247b06dcd61be30" }, "userId" : "6394e22877a382e42b5302a9", "uid" : "6402399fed47ecfdd68174cc", "textContent" : "hi", "isSent" : true, "isSeen" : false, "isRead" : true, "email" : "ceo@gmail.com", "time" : "3/8/2023, 8:46:32 PM", "createdAt" : { "$date" : "2023-03-09T01:46:32.458+0000" }, "updatedAt" : { "$date" : "2023-04-27T02:55:46.770+0000" }, "__v" : 0 },
{ "_id" : { "$oid" : "64093a87f247b06dcd61be3b" }, "userId" : "6394e22877a382e42b5302a9", "uid" : "6402399fed47ecfdd68174cc", "textContent" : "Hello", "isSent" : false, "isSeen" : false, "isRead" : true, "email" : "ceo@gmail.com", "time" : "3/8/2023, 8:46:47 PM", "createdAt" : { "$date" : "2023-03-09T01:46:47.161+0000" }, "updatedAt" : { "$date" : "2023-04-27T02:55:46.770+0000" }, "__v" : 0 },
{ "_id" : { "$oid" : "640a2d796f5567e298370fc5" }, "userId" : "6394e22877a382e42b5302a9", "uid" : "63f83dc8b535a7e0062d0fb6", "textContent" : "hi", "isSent" : false, "isSeen" : false, "isRead" : true, "email" : "bisharat.akram1999@gmail.com", "time" : "3/9/2023, 2:03:21 PM", "createdAt" : { "$date" : "2023-03-09T19:03:21.126+0000" }, "updatedAt" : { "$date" : "2023-04-27T02:56:19.938+0000" }, "__v" : 0 },
{ "_id" : { "$oid" : "641182002cc16a511be8e8d8" }, "userId" : "6394e22877a382e42b5302a9", "uid" : "63f83dc8b535a7e0062d0fb6", "textContent" : "helo", "isSent" : true, "isSeen" : false, "isRead" : true, "email" : "bisharat.akram1999@gmail.com", "time" : "3/15/2023, 4:29:52 AM", "createdAt" : { "$date" : "2023-03-15T08:29:52.484+0000" }, "updatedAt" : { "$date" : "2023-04-27T02:56:19.938+0000" }, "__v" : 0 },
{ "_id" : { "$oid" : "641182262cc16a511be8e8e1" }, "userId" : "6394e22877a382e42b5302a9", "uid" : "63f83dc8b535a7e0062d0fb6", "textContent" : "Hi from receiver", "isSent" : false, "isSeen" : false, "isRead" : true, "email" : "bisharat.akram1999@gmail.com", "time" : "3/15/2023, 4:30:30 AM", "createdAt" : { "$date" : "2023-03-15T08:30:30.441+0000" }, "updatedAt" : { "$date" : "2023-04-27T02:56:19.938+0000" }, "__v" : 0 },
{ "_id" : { "$oid" : "641182712cc16a511be8ee8a" }, "userId" : "6394e22877a382e42b5302a9", "uid" : "63f83dc8b535a7e0062d0fb6", "textContent" : "hi", "isSent" : false, "isSeen" : false, "isRead" : true, "email" : "bisharat.akram1999@gmail.com", "time" : "3/15/2023, 4:31:45 AM", "createdAt" : { "$date" : "2023-03-15T08:31:45.357+0000" }, "updatedAt" : { "$date" : "2023-04-27T02:56:19.938+0000" }, "__v" : 0 },
{ "_id" : { "$oid" : "641182812cc16a511be8ee91" }, "userId" : "6394e22877a382e42b5302a9", "uid" : "63f83dc8b535a7e0062d0fb6", "textContent" : "hlo", "isSent" : false, "isSeen" : false, "isRead" : true, "email" : "bisharat.akram1999@gmail.com", "time" : "3/15/2023, 4:32:01 AM", "createdAt" : { "$date" : "2023-03-15T08:32:01.140+0000" }, "updatedAt" : { "$date" : "2023-04-27T02:56:19.938+0000" }, "__v" : 0 },
{ "_id" : { "$oid" : "6413c6a8d5111f3960fbacf2" }, "userId" : "6394e22877a382e42b5302a9", "uid" : "63f83dc8b535a7e0062d0fb6", "textContent" : "hi", "isSent" : true, "isSeen" : false, "isRead" : true, "email" : "bisharat.akram1999@gmail.com", "time" : "3/16/2023, 9:47:20 PM", "createdAt" : { "$date" : "2023-03-17T01:47:20.868+0000" }, "updatedAt" : { "$date" : "2023-04-27T02:56:19.938+0000" }, "__v" : 0 },
{ "_id" : { "$oid" : "6413c6c1d5111f3960fbad49" }, "userId" : "6394e22877a382e42b5302a9", "uid" : "63f83dc8b535a7e0062d0fb6", "textContent" : "hlo", "isSent" : false, "isSeen" : false, "isRead" : true, "email" : "bisharat.akram1999@gmail.com", "time" : "3/16/2023, 9:47:45 PM", "createdAt" : { "$date" : "2023-03-17T01:47:45.530+0000" }, "updatedAt" : { "$date" : "2023-04-27T02:56:19.938+0000" }, "__v" : 0 },
{ "_id" : { "$oid" : "6413c76ad5111f3960fbb071" }, "userId" : "6394e22877a382e42b5302a9", "uid" : "63f83dc8b535a7e0062d0fb6", "textContent" : "kia", "isSent" : false, "isSeen" : false, "isRead" : true, "email" : "bisharat.akram1999@gmail.com", "time" : "3/16/2023, 9:50:34 PM", "createdAt" : { "$date" : "2023-03-17T01:50:34.548+0000" }, "updatedAt" : { "$date" : "2023-04-27T02:56:19.938+0000" }, "__v" : 0 },
{ "_id" : { "$oid" : "6413d6d0d5111f3960fbc8f5" }, "userId" : "6394e22877a382e42b5302a9", "uid" : "63f83dc8b535a7e0062d0fb6", "textContent" : "hi", "isSent" : true, "isSeen" : false, "isRead" : true, "email" : "bisharat.akram1999@gmail.com", "time" : "3/16/2023, 10:56:16 PM", "createdAt" : { "$date" : "2023-03-17T02:56:16.489+0000" }, "updatedAt" : { "$date" : "2023-04-27T02:56:19.938+0000" }, "__v" : 0 },
{ "_id" : { "$oid" : "64141d78d5111f3960fbef92" }, "userId" : "6394e22877a382e42b5302a9", "uid" : "63f83dc8b535a7e0062d0fb6", "textContent" : "HELLO", "isSent" : true, "isSeen" : false, "isRead" : true, "email" : "bisharat.akram1999@gmail.com", "time" : "3/17/2023, 3:57:44 AM", "createdAt" : { "$date" : "2023-03-17T07:57:44.390+0000" }, "updatedAt" : { "$date" : "2023-04-27T02:56:19.938+0000" }, "__v" : 0 },
{ "_id" : { "$oid" : "64141dfed5111f3960fbf10b" }, "userId" : "6394e22877a382e42b5302a9", "uid" : "63f83dc8b535a7e0062d0fb6", "textContent" : "JHFVEJ", "isSent" : true, "isSeen" : false, "isRead" : true, "email" : "bisharat.akram1999@gmail.com", "time" : "3/17/2023, 3:59:58 AM", "createdAt" : { "$date" : "2023-03-17T07:59:58.393+0000" }, "updatedAt" : { "$date" : "2023-04-27T02:56:19.938+0000" }, "__v" : 0 },
{ "_id" : { "$oid" : "64141e04d5111f3960fbf114" }, "userId" : "6394e22877a382e42b5302a9", "uid" : "63f83dc8b535a7e0062d0fb6", "textContent" : "hi", "isSent" : false, "isSeen" : false, "isRead" : true, "email" : "bisharat.akram1999@gmail.com", "time" : "3/17/2023, 4:00:04 AM", "createdAt" : { "$date" : "2023-03-17T08:00:04.853+0000" }, "updatedAt" : { "$date" : "2023-04-27T02:56:19.938+0000" }, "__v" : 0 },
{ "_id" : { "$oid" : "64141e12d5111f3960fbf1ae" }, "userId" : "6394e22877a382e42b5302a9", "uid" : "63f83dc8b535a7e0062d0fb6", "textContent" : "RFR", "isSent" : true, "isSeen" : false, "isRead" : true, "email" : "bisharat.akram1999@gmail.com", "time" : "3/17/2023, 4:00:18 AM", "createdAt" : { "$date" : "2023-03-17T08:00:18.197+0000" }, "updatedAt" : { "$date" : "2023-04-27T02:56:19.938+0000" }, "__v" : 0 },
{ "_id" : { "$oid" : "64141e1bd5111f3960fbf1b7" }, "userId" : "6394e22877a382e42b5302a9", "uid" : "63f83dc8b535a7e0062d0fb6", "textContent" : "l", "isSent" : false, "isSeen" : false, "isRead" : true, "email" : "bisharat.akram1999@gmail.com", "time" : "3/17/2023, 4:00:27 AM", "createdAt" : { "$date" : "2023-03-17T08:00:27.154+0000" }, "updatedAt" : { "$date" : "2023-04-27T02:56:19.938+0000" }, "__v" : 0 },
{ "_id" : { "$oid" : "64141e2bd5111f3960fbf1c2" }, "userId" : "6394e22877a382e42b5302a9", "uid" : "63f83dc8b535a7e0062d0fb6", "textContent" : "l", "isSent" : false, "isSeen" : false, "isRead" : true, "email" : "bisharat.akram1999@gmail.com", "time" : "3/17/2023, 4:00:43 AM", "createdAt" : { "$date" : "2023-03-17T08:00:43.158+0000" }, "updatedAt" : { "$date" : "2023-04-27T02:56:19.938+0000" }, "__v" : 0 },
{ "_id" : { "$oid" : "64141fa2d5111f3960fbf3f3" }, "userId" : "6394e22877a382e42b5302a9", "uid" : "63f83dc8b535a7e0062d0fb6", "textContent" : "hlo", "isSent" : false, "isSeen" : false, "isRead" : true, "email" : "bisharat.akram1999@gmail.com", "time" : "3/17/2023, 4:06:58 AM", "createdAt" : { "$date" : "2023-03-17T08:06:58.534+0000" }, "updatedAt" : { "$date" : "2023-04-27T02:56:19.938+0000" }, "__v" : 0 },
{ "_id" : { "$oid" : "64141fb8d5111f3960fbf4bb" }, "userId" : "6394e22877a382e42b5302a9", "uid" : "63f83dc8b535a7e0062d0fb6", "textContent" : "hlooo", "isSent" : false, "isSeen" : false, "isRead" : true, "email" : "bisharat.akram1999@gmail.com", "time" : "3/17/2023, 4:07:20 AM", "createdAt" : { "$date" : "2023-03-17T08:07:20.373+0000" }, "updatedAt" : { "$date" : "2023-04-27T02:56:19.938+0000" }, "__v" : 0 },
{ "_id" : { "$oid" : "6414204ed5111f3960fbf597" }, "userId" : "6394e22877a382e42b5302a9", "uid" : "63f83dc8b535a7e0062d0fb6", "textContent" : "bye", "isSent" : false, "isSeen" : false, "isRead" : true, "email" : "bisharat.akram1999@gmail.com", "time" : "3/17/2023, 4:09:50 AM", "createdAt" : { "$date" : "2023-03-17T08:09:50.320+0000" }, "updatedAt" : { "$date" : "2023-04-27T02:56:19.938+0000" }, "__v" : 0 },
{ "_id" : { "$oid" : "6414205ed5111f3960fbf5ee" }, "userId" : "6394e22877a382e42b5302a9", "uid" : "63f83dc8b535a7e0062d0fb6", "textContent" : "hi", "isSent" : false, "isSeen" : false, "isRead" : true, "email" : "bisharat.akram1999@gmail.com", "time" : "3/17/2023, 4:10:06 AM", "createdAt" : { "$date" : "2023-03-17T08:10:06.989+0000" }, "updatedAt" : { "$date" : "2023-04-27T02:56:19.938+0000" }, "__v" : 0 },
{ "_id" : { "$oid" : "6414207dd5111f3960fbf6ab" }, "userId" : "6394e22877a382e42b5302a9", "uid" : "63f83dc8b535a7e0062d0fb6", "textContent" : "hlo", "isSent" : false, "isSeen" : false, "isRead" : true, "email" : "bisharat.akram1999@gmail.com", "time" : "3/17/2023, 4:10:37 AM", "createdAt" : { "$date" : "2023-03-17T08:10:37.140+0000" }, "updatedAt" : { "$date" : "2023-04-27T02:56:19.938+0000" }, "__v" : 0 },
{ "_id" : { "$oid" : "641565751b26ffdabdfe5caa" }, "userId" : "6394e22877a382e42b5302a9", "uid" : "63f83dc8b535a7e0062d0fb6", "textContent" : "hi", "isSent" : true, "isSeen" : false, "isRead" : true, "email" : "bisharat.akram1999@gmail.com", "time" : "3/18/2023, 3:17:09 AM", "createdAt" : { "$date" : "2023-03-18T07:17:09.495+0000" }, "updatedAt" : { "$date" : "2023-04-27T02:56:19.938+0000" }, "__v" : 0 },
{ "_id" : { "$oid" : "641565821b26ffdabdfe5cb3" }, "userId" : "6394e22877a382e42b5302a9", "uid" : "63f83dc8b535a7e0062d0fb6", "textContent" : "hlo", "isSent" : false, "isSeen" : false, "isRead" : true, "email" : "bisharat.akram1999@gmail.com", "time" : "3/18/2023, 3:17:22 AM", "createdAt" : { "$date" : "2023-03-18T07:17:22.104+0000" }, "updatedAt" : { "$date" : "2023-04-27T02:56:19.938+0000" }, "__v" : 0 },
{ "_id" : { "$oid" : "64157d2a1b26ffdabdfe5f87" }, "userId" : "6394e22877a382e42b5302a9", "uid" : "63f83dc8b535a7e0062d0fb6", "textContent" : "hi", "isSent" : false, "isSeen" : false, "isRead" : true, "email" : "bisharat.akram1999@gmail.com", "time" : "3/18/2023, 4:58:18 AM", "createdAt" : { "$date" : "2023-03-18T08:58:18.807+0000" }, "updatedAt" : { "$date" : "2023-04-27T02:56:19.938+0000" }, "__v" : 0 },
{ "_id" : { "$oid" : "64157d3f1b26ffdabdfe5f99" }, "userId" : "6394e22877a382e42b5302a9", "uid" : "63f83dc8b535a7e0062d0fb6", "textContent" : "hi", "isSent" : false, "isSeen" : false, "isRead" : true, "email" : "bisharat.akram1999@gmail.com", "time" : "3/18/2023, 4:58:39 AM", "createdAt" : { "$date" : "2023-03-18T08:58:39.104+0000" }, "updatedAt" : { "$date" : "2023-04-27T02:56:19.938+0000" }, "__v" : 0 },
{ "_id" : { "$oid" : "64157d481b26ffdabdfe5fb8" }, "userId" : "6394e22877a382e42b5302a9", "uid" : "63f83dc8b535a7e0062d0fb6", "textContent" : "hlo", "isSent" : false, "isSeen" : false, "isRead" : true, "email" : "bisharat.akram1999@gmail.com", "time" : "3/18/2023, 4:58:48 AM", "createdAt" : { "$date" : "2023-03-18T08:58:48.059+0000" }, "updatedAt" : { "$date" : "2023-04-27T02:56:19.938+0000" }, "__v" : 0 },
{ "_id" : { "$oid" : "64157d4e1b26ffdabdfe5fd7" }, "userId" : "6394e22877a382e42b5302a9", "uid" : "63f83dc8b535a7e0062d0fb6", "textContent" : "kia hal", "isSent" : false, "isSeen" : false, "isRead" : true, "email" : "bisharat.akram1999@gmail.com", "time" : "3/18/2023, 4:58:54 AM", "createdAt" : { "$date" : "2023-03-18T08:58:54.488+0000" }, "updatedAt" : { "$date" : "2023-04-27T02:56:19.938+0000" }, "__v" : 0 },
{ "_id" : { "$oid" : "64157d541b26ffdabdfe5ff8" }, "userId" : "6394e22877a382e42b5302a9", "uid" : "63f83dc8b535a7e0062d0fb6", "textContent" : "bye", "isSent" : false, "isSeen" : false, "isRead" : true, "email" : "bisharat.akram1999@gmail.com", "time" : "3/18/2023, 4:59:00 AM", "createdAt" : { "$date" : "2023-03-18T08:59:00.641+0000" }, "updatedAt" : { "$date" : "2023-04-27T02:56:19.938+0000" }, "__v" : 0 },
{ "_id" : { "$oid" : "64157d5a1b26ffdabdfe6019" }, "userId" : "6394e22877a382e42b5302a9", "uid" : "63f83dc8b535a7e0062d0fb6", "textContent" : "helloo", "isSent" : false, "isSeen" : false, "isRead" : true, "email" : "bisharat.akram1999@gmail.com", "time" : "3/18/2023, 4:59:06 AM", "createdAt" : { "$date" : "2023-03-18T08:59:06.897+0000" }, "updatedAt" : { "$date" : "2023-04-27T02:56:19.938+0000" }, "__v" : 0 },
{ "_id" : { "$oid" : "64157d671b26ffdabdfe603e" }, "userId" : "6394e22877a382e42b5302a9", "uid" : "63f83dc8b535a7e0062d0fb6", "textContent" : "hi", "isSent" : false, "isSeen" : false, "isRead" : true, "email" : "bisharat.akram1999@gmail.com", "time" : "3/18/2023, 4:59:19 AM", "createdAt" : { "$date" : "2023-03-18T08:59:19.526+0000" }, "updatedAt" : { "$date" : "2023-04-27T02:56:19.938+0000" }, "__v" : 0 },
{ "_id" : { "$oid" : "64157d751b26ffdabdfe6063" }, "userId" : "6394e22877a382e42b5302a9", "uid" : "63f83dc8b535a7e0062d0fb6", "textContent" : "hi", "isSent" : false, "isSeen" : false, "isRead" : true, "email" : "bisharat.akram1999@gmail.com", "time" : "3/18/2023, 4:59:33 AM", "createdAt" : { "$date" : "2023-03-18T08:59:33.153+0000" }, "updatedAt" : { "$date" : "2023-04-27T02:56:19.938+0000" }, "__v" : 0 },
{ "_id" : { "$oid" : "6417b928191f75863db02e57" }, "userId" : "6394e22877a382e42b5302a9", "uid" : "6417b914191f75863db02ce6", "textContent" : "helo", "isSent" : true, "isSeen" : false, "isRead" : true, "email" : "demo@mymanager.com", "time" : "3/19/2023, 9:38:48 PM", "createdAt" : { "$date" : "2023-03-20T01:38:48.836+0000" }, "updatedAt" : { "$date" : "2023-04-28T12:20:39.720+0000" }, "__v" : 0 },
{ "_id" : { "$oid" : "6417b9ce191f75863db0311d" }, "userId" : "6394e22877a382e42b5302a9", "uid" : "6417b914191f75863db02ce6", "textContent" : "helo", "isSent" : true, "isSeen" : false, "isRead" : true, "email" : "demo@mymanager.com", "time" : "3/19/2023, 9:41:34 PM", "createdAt" : { "$date" : "2023-03-20T01:41:34.842+0000" }, "updatedAt" : { "$date" : "2023-04-28T12:20:39.720+0000" }, "__v" : 0 },
{ "_id" : { "$oid" : "6417b9e7191f75863db03126" }, "userId" : "6394e22877a382e42b5302a9", "uid" : "6417b914191f75863db02ce6", "textContent" : "hi", "isSent" : false, "isSeen" : false, "isRead" : true, "email" : "demo@mymanager.com", "time" : "3/19/2023, 9:41:59 PM", "createdAt" : { "$date" : "2023-03-20T01:41:59.403+0000" }, "updatedAt" : { "$date" : "2023-04-28T12:20:39.720+0000" }, "__v" : 0 },
{ "_id" : { "$oid" : "6417ba29191f75863db03266" }, "userId" : "6394e22877a382e42b5302a9", "uid" : "6417b914191f75863db02ce6", "textContent" : "hi", "isSent" : false, "isSeen" : false, "isRead" : true, "email" : "demo@mymanager.com", "time" : "3/19/2023, 9:43:05 PM", "createdAt" : { "$date" : "2023-03-20T01:43:05.452+0000" }, "updatedAt" : { "$date" : "2023-04-28T12:20:39.720+0000" }, "__v" : 0 },
{ "_id" : { "$oid" : "6417bb37191f75863db03562" }, "userId" : "6394e22877a382e42b5302a9", "uid" : "6417b914191f75863db02ce6", "textContent" : "hi", "isSent" : false, "isSeen" : false, "isRead" : true, "email" : "demo@mymanager.com", "time" : "3/19/2023, 9:47:35 PM", "createdAt" : { "$date" : "2023-03-20T01:47:35.793+0000" }, "updatedAt" : { "$date" : "2023-04-28T12:20:39.720+0000" }, "__v" : 0 },
{ "_id" : { "$oid" : "6417bc78191f75863db03dea" }, "userId" : "6394e22877a382e42b5302a9", "uid" : "6417b914191f75863db02ce6", "textContent" : "hi", "isSent" : false, "isSeen" : false, "isRead" : true, "email" : "demo@mymanager.com", "time" : "3/19/2023, 9:52:56 PM", "createdAt" : { "$date" : "2023-03-20T01:52:56.440+0000" }, "updatedAt" : { "$date" : "2023-04-28T12:20:39.720+0000" }, "__v" : 0 },
{ "_id" : { "$oid" : "6417c0f3191f75863db04818" }, "userId" : "6394e22877a382e42b5302a9", "uid" : "6417b914191f75863db02ce6", "textContent" : "hlo 98", "isSent" : false, "isSeen" : false, "isRead" : true, "email" : "demo@mymanager.com", "time" : "3/19/2023, 10:12:03 PM", "createdAt" : { "$date" : "2023-03-20T02:12:03.787+0000" }, "updatedAt" : { "$date" : "2023-04-28T12:20:39.720+0000" }, "__v" : 0 },
{ "_id" : { "$oid" : "6417c15a191f75863db04aed" }, "userId" : "6394e22877a382e42b5302a9", "uid" : "6417b914191f75863db02ce6", "textContent" : "hli96", "isSent" : false, "isSeen" : false, "isRead" : true, "email" : "demo@mymanager.com", "time" : "3/19/2023, 10:13:46 PM", "createdAt" : { "$date" : "2023-03-20T02:13:46.605+0000" }, "updatedAt" : { "$date" : "2023-04-28T12:20:39.720+0000" }, "__v" : 0 },
{ "_id" : { "$oid" : "6417c1ed191f75863db04d81" }, "userId" : "6394e22877a382e42b5302a9", "uid" : "6417b914191f75863db02ce6", "textContent" : "hlo 99", "isSent" : false, "isSeen" : false, "isRead" : true, "email" : "demo@mymanager.com", "time" : "3/19/2023, 10:16:13 PM", "createdAt" : { "$date" : "2023-03-20T02:16:13.862+0000" }, "updatedAt" : { "$date" : "2023-04-28T12:20:39.720+0000" }, "__v" : 0 },
{ "_id" : { "$oid" : "6417c21f191f75863db04f76" }, "userId" : "6394e22877a382e42b5302a9", "uid" : "6417b914191f75863db02ce6", "textContent" : "hlo 56", "isSent" : false, "isSeen" : false, "isRead" : true, "email" : "demo@mymanager.com", "time" : "3/19/2023, 10:17:03 PM", "createdAt" : { "$date" : "2023-03-20T02:17:03.805+0000" }, "updatedAt" : { "$date" : "2023-04-28T12:20:39.720+0000" }, "__v" : 0 },
{ "_id" : { "$oid" : "6417c2a9191f75863db051c3" }, "userId" : "6394e22877a382e42b5302a9", "uid" : "6417b914191f75863db02ce6", "textContent" : "hlo 55", "isSent" : false, "isSeen" : false, "isRead" : true, "email" : "demo@mymanager.com", "time" : "3/19/2023, 10:19:21 PM", "createdAt" : { "$date" : "2023-03-20T02:19:21.181+0000" }, "updatedAt" : { "$date" : "2023-04-28T12:20:39.720+0000" }, "__v" : 0 },
{ "_id" : { "$oid" : "6417c2b9191f75863db052ec" }, "userId" : "6394e22877a382e42b5302a9", "uid" : "6417b914191f75863db02ce6", "textContent" : "hlo 77", "isSent" : false, "isSeen" : false, "isRead" : true, "email" : "demo@mymanager.com", "time" : "3/19/2023, 10:19:37 PM", "createdAt" : { "$date" : "2023-03-20T02:19:37.532+0000" }, "updatedAt" : { "$date" : "2023-04-28T12:20:39.720+0000" }, "__v" : 0 },
{ "_id" : { "$oid" : "6417c338191f75863db05869" }, "userId" : "6394e22877a382e42b5302a9", "uid" : "6417b914191f75863db02ce6", "textContent" : "hlo 54", "isSent" : false, "isSeen" : false, "isRead" : true, "email" : "demo@mymanager.com", "time" : "3/19/2023, 10:21:44 PM", "createdAt" : { "$date" : "2023-03-20T02:21:44.290+0000" }, "updatedAt" : { "$date" : "2023-04-28T12:20:39.720+0000" }, "__v" : 0 },
{ "_id" : { "$oid" : "6417c346191f75863db05995" }, "userId" : "6394e22877a382e42b5302a9", "uid" : "6417b914191f75863db02ce6", "textContent" : "hlo 96", "isSent" : false, "isSeen" : false, "isRead" : true, "email" : "demo@mymanager.com", "time" : "3/19/2023, 10:21:58 PM", "createdAt" : { "$date" : "2023-03-20T02:21:58.971+0000" }, "updatedAt" : { "$date" : "2023-04-28T12:20:39.720+0000" }, "__v" : 0 },
{ "_id" : { "$oid" : "6417c3f3191f75863db060aa" }, "userId" : "6394e22877a382e42b5302a9", "uid" : "6417b914191f75863db02ce6", "textContent" : "hlo 99", "isSent" : false, "isSeen" : false, "isRead" : true, "email" : "demo@mymanager.com", "time" : "3/19/2023, 10:24:51 PM", "createdAt" : { "$date" : "2023-03-20T02:24:51.947+0000" }, "updatedAt" : { "$date" : "2023-04-28T12:20:39.720+0000" }, "__v" : 0 },
{ "_id" : { "$oid" : "6417c401191f75863db061bc" }, "userId" : "6394e22877a382e42b5302a9", "uid" : "6417b914191f75863db02ce6", "textContent" : "hlo 98", "isSent" : false, "isSeen" : false, "isRead" : true, "email" : "demo@mymanager.com", "time" : "3/19/2023, 10:25:05 PM", "createdAt" : { "$date" : "2023-03-20T02:25:05.691+0000" }, "updatedAt" : { "$date" : "2023-04-28T12:20:39.720+0000" }, "__v" : 0 },
{ "_id" : { "$oid" : "6417c40c191f75863db062c8" }, "userId" : "6394e22877a382e42b5302a9", "uid" : "6417b914191f75863db02ce6", "textContent" : "hlo 96", "isSent" : false, "isSeen" : false, "isRead" : true, "email" : "demo@mymanager.com", "time" : "3/19/2023, 10:25:16 PM", "createdAt" : { "$date" : "2023-03-20T02:25:16.327+0000" }, "updatedAt" : { "$date" : "2023-04-28T12:20:39.720+0000" }, "__v" : 0 },
{ "_id" : { "$oid" : "6417c447191f75863db0698d" }, "userId" : "6394e22877a382e42b5302a9", "uid" : "6417b914191f75863db02ce6", "textContent" : "hlo 87", "isSent" : false, "isSeen" : false, "isRead" : true, "email" : "demo@mymanager.com", "time" : "3/19/2023, 10:26:15 PM", "createdAt" : { "$date" : "2023-03-20T02:26:15.275+0000" }, "updatedAt" : { "$date" : "2023-04-28T12:20:39.720+0000" }, "__v" : 0 },
{ "_id" : { "$oid" : "6417c457191f75863db06a4e" }, "userId" : "6394e22877a382e42b5302a9", "uid" : "6417b914191f75863db02ce6", "textContent" : "hlo 88", "isSent" : false, "isSeen" : false, "isRead" : true, "email" : "demo@mymanager.com", "time" : "3/19/2023, 10:26:31 PM", "createdAt" : { "$date" : "2023-03-20T02:26:31.223+0000" }, "updatedAt" : { "$date" : "2023-04-28T12:20:39.720+0000" }, "__v" : 0 },
{ "_id" : { "$oid" : "6417c46a191f75863db06c28" }, "userId" : "6394e22877a382e42b5302a9", "uid" : "6417b914191f75863db02ce6", "textContent" : "hlo 99", "isSent" : false, "isSeen" : false, "isRead" : true, "email" : "demo@mymanager.com", "time" : "3/19/2023, 10:26:50 PM", "createdAt" : { "$date" : "2023-03-20T02:26:50.441+0000" }, "updatedAt" : { "$date" : "2023-04-28T12:20:39.720+0000" }, "__v" : 0 },
{ "_id" : { "$oid" : "6417c478191f75863db06deb" }, "userId" : "6394e22877a382e42b5302a9", "uid" : "6417b914191f75863db02ce6", "textContent" : "hlo 96", "isSent" : false, "isSeen" : false, "isRead" : true, "email" : "demo@mymanager.com", "time" : "3/19/2023, 10:27:04 PM", "createdAt" : { "$date" : "2023-03-20T02:27:04.368+0000" }, "updatedAt" : { "$date" : "2023-04-28T12:20:39.720+0000" }, "__v" : 0 },
{ "_id" : { "$oid" : "6417c481191f75863db06ee7" }, "userId" : "6394e22877a382e42b5302a9", "uid" : "6417b914191f75863db02ce6", "textContent" : "hlo 95", "isSent" : false, "isSeen" : false, "isRead" : true, "email" : "demo@mymanager.com", "time" : "3/19/2023, 10:27:13 PM", "createdAt" : { "$date" : "2023-03-20T02:27:13.150+0000" }, "updatedAt" : { "$date" : "2023-04-28T12:20:39.720+0000" }, "__v" : 0 },
{ "_id" : { "$oid" : "6417c4d3191f75863db08077" }, "userId" : "6394e22877a382e42b5302a9", "uid" : "6417b914191f75863db02ce6", "textContent" : "hlo 99", "isSent" : false, "isSeen" : false, "isRead" : true, "email" : "demo@mymanager.com", "time" : "3/19/2023, 10:28:35 PM", "createdAt" : { "$date" : "2023-03-20T02:28:35.748+0000" }, "updatedAt" : { "$date" : "2023-04-28T12:20:39.720+0000" }, "__v" : 0 },
{ "_id" : { "$oid" : "6417c51d191f75863db0827d" }, "userId" : "6394e22877a382e42b5302a9", "uid" : "6417b914191f75863db02ce6", "textContent" : "hlo 98", "isSent" : false, "isSeen" : false, "isRead" : true, "email" : "demo@mymanager.com", "time" : "3/19/2023, 10:29:49 PM", "createdAt" : { "$date" : "2023-03-20T02:29:49.505+0000" }, "updatedAt" : { "$date" : "2023-04-28T12:20:39.720+0000" }, "__v" : 0 },
{ "_id" : { "$oid" : "6417c530191f75863db083ec" }, "userId" : "6394e22877a382e42b5302a9", "uid" : "6417b914191f75863db02ce6", "textContent" : "hlo 97", "isSent" : false, "isSeen" : false, "isRead" : true, "email" : "demo@mymanager.com", "time" : "3/19/2023, 10:30:08 PM", "createdAt" : { "$date" : "2023-03-20T02:30:08.938+0000" }, "updatedAt" : { "$date" : "2023-04-28T12:20:39.720+0000" }, "__v" : 0 },
{ "_id" : { "$oid" : "6417c66f191f75863db09324" }, "userId" : "6394e22877a382e42b5302a9", "uid" : "6417b914191f75863db02ce6", "textContent" : "hi 23", "isSent" : false, "isSeen" : false, "isRead" : true, "email" : "demo@mymanager.com", "time" : "3/19/2023, 10:35:27 PM", "createdAt" : { "$date" : "2023-03-20T02:35:27.638+0000" }, "updatedAt" : { "$date" : "2023-04-28T12:20:39.720+0000" }, "__v" : 0 },
{ "_id" : { "$oid" : "6417c6f5191f75863db0b484" }, "userId" : "6394e22877a382e42b5302a9", "uid" : "6417b914191f75863db02ce6", "textContent" : "hi", "isSent" : false, "isSeen" : false, "isRead" : true, "email" : "demo@mymanager.com", "time" : "3/19/2023, 10:37:41 PM", "createdAt" : { "$date" : "2023-03-20T02:37:41.127+0000" }, "updatedAt" : { "$date" : "2023-04-28T12:20:39.720+0000" }, "__v" : 0 },
{ "_id" : { "$oid" : "6417c740191f75863db0b636" }, "userId" : "6394e22877a382e42b5302a9", "uid" : "6417b914191f75863db02ce6", "textContent" : "hlo 98", "isSent" : false, "isSeen" : false, "isRead" : true, "email" : "demo@mymanager.com", "time" : "3/19/2023, 10:38:56 PM", "createdAt" : { "$date" : "2023-03-20T02:38:56.871+0000" }, "updatedAt" : { "$date" : "2023-04-28T12:20:39.720+0000" }, "__v" : 0 },
{ "_id" : { "$oid" : "6417c753191f75863db0b6e9" }, "userId" : "6394e22877a382e42b5302a9", "uid" : "6417b914191f75863db02ce6", "textContent" : "hi 99", "isSent" : false, "isSeen" : false, "isRead" : true, "email" : "demo@mymanager.com", "time" : "3/19/2023, 10:39:15 PM", "createdAt" : { "$date" : "2023-03-20T02:39:15.086+0000" }, "updatedAt" : { "$date" : "2023-04-28T12:20:39.720+0000" }, "__v" : 0 },
{ "_id" : { "$oid" : "6417c796191f75863db0b7ec" }, "userId" : "6394e22877a382e42b5302a9", "uid" : "6417b914191f75863db02ce6", "textContent" : "hlo 95", "isSent" : false, "isSeen" : false, "isRead" : true, "email" : "demo@mymanager.com", "time" : "3/19/2023, 10:40:22 PM", "createdAt" : { "$date" : "2023-03-20T02:40:22.257+0000" }, "updatedAt" : { "$date" : "2023-04-28T12:20:39.720+0000" }, "__v" : 0 },
{ "_id" : { "$oid" : "6417c7d0191f75863db0b946" }, "userId" : "6394e22877a382e42b5302a9", "uid" : "6417b914191f75863db02ce6", "textContent" : "hlooo", "isSent" : false, "isSeen" : false, "isRead" : true, "email" : "demo@mymanager.com", "time" : "3/19/2023, 10:41:20 PM", "createdAt" : { "$date" : "2023-03-20T02:41:20.674+0000" }, "updatedAt" : { "$date" : "2023-04-28T12:20:39.720+0000" }, "__v" : 0 },
{ "_id" : { "$oid" : "6417c851191f75863db0ba6e" }, "userId" : "6394e22877a382e42b5302a9", "uid" : "6417b914191f75863db02ce6", "textContent" : "hlo 96", "isSent" : false, "isSeen" : false, "isRead" : true, "email" : "demo@mymanager.com", "time" : "3/19/2023, 10:43:29 PM", "createdAt" : { "$date" : "2023-03-20T02:43:29.727+0000" }, "updatedAt" : { "$date" : "2023-04-28T12:20:39.720+0000" }, "__v" : 0 },
{ "_id" : { "$oid" : "6417c867191f75863db0bb1d" }, "userId" : "6394e22877a382e42b5302a9", "uid" : "6417b914191f75863db02ce6", "textContent" : "hlo 88", "isSent" : false, "isSeen" : false, "isRead" : true, "email" : "demo@mymanager.com", "time" : "3/19/2023, 10:43:51 PM", "createdAt" : { "$date" : "2023-03-20T02:43:51.502+0000" }, "updatedAt" : { "$date" : "2023-04-28T12:20:39.720+0000" }, "__v" : 0 },
{ "_id" : { "$oid" : "6417c877191f75863db0bb6f" }, "userId" : "6394e22877a382e42b5302a9", "uid" : "6417b914191f75863db02ce6", "textContent" : "hlo 99", "isSent" : false, "isSeen" : false, "isRead" : true, "email" : "demo@mymanager.com", "time" : "3/19/2023, 10:44:07 PM", "createdAt" : { "$date" : "2023-03-20T02:44:07.046+0000" }, "updatedAt" : { "$date" : "2023-04-28T12:20:39.720+0000" }, "__v" : 0 },
{ "_id" : { "$oid" : "6417c89c191f75863db0bbc7" }, "userId" : "6394e22877a382e42b5302a9", "uid" : "6417b914191f75863db02ce6", "textContent" : "hi 88", "isSent" : false, "isSeen" : false, "isRead" : true, "email" : "demo@mymanager.com", "time" : "3/19/2023, 10:44:44 PM", "createdAt" : { "$date" : "2023-03-20T02:44:44.995+0000" }, "updatedAt" : { "$date" : "2023-04-28T12:20:39.720+0000" }, "__v" : 0 },
{ "_id" : { "$oid" : "6417ca1c191f75863db0be65" }, "userId" : "6394e22877a382e42b5302a9", "uid" : "6417b914191f75863db02ce6", "textContent" : "hlo 90", "isSent" : false, "isSeen" : false, "isRead" : true, "email" : "demo@mymanager.com", "time" : "3/19/2023, 10:51:08 PM", "createdAt" : { "$date" : "2023-03-20T02:51:08.680+0000" }, "updatedAt" : { "$date" : "2023-04-28T12:20:39.720+0000" }, "__v" : 0 },
{ "_id" : { "$oid" : "6417cc8d191f75863db0c28b" }, "userId" : "6394e22877a382e42b5302a9", "uid" : "6417b914191f75863db02ce6", "textContent" : "hlo 98", "isSent" : false, "isSeen" : false, "isRead" : true, "email" : "demo@mymanager.com", "time" : "3/19/2023, 11:01:33 PM", "createdAt" : { "$date" : "2023-03-20T03:01:34.004+0000" }, "updatedAt" : { "$date" : "2023-04-28T12:20:39.720+0000" }, "__v" : 0 },
{ "_id" : { "$oid" : "6417cd29191f75863db0c2e5" }, "userId" : "6394e22877a382e42b5302a9", "uid" : "6417b914191f75863db02ce6", "textContent" : "hi 76", "isSent" : false, "isSeen" : false, "isRead" : true, "email" : "demo@mymanager.com", "time" : "3/19/2023, 11:04:09 PM", "createdAt" : { "$date" : "2023-03-20T03:04:09.566+0000" }, "updatedAt" : { "$date" : "2023-04-28T12:20:39.720+0000" }, "__v" : 0 },
{ "_id" : { "$oid" : "6417cd83191f75863db0c405" }, "userId" : "6394e22877a382e42b5302a9", "uid" : "6417b914191f75863db02ce6", "textContent" : "hyyy", "isSent" : false, "isSeen" : false, "isRead" : true, "email" : "demo@mymanager.com", "time" : "3/19/2023, 11:05:39 PM", "createdAt" : { "$date" : "2023-03-20T03:05:39.949+0000" }, "updatedAt" : { "$date" : "2023-04-28T12:20:39.720+0000" }, "__v" : 0 },
{ "_id" : { "$oid" : "6417cd9a191f75863db0c459" }, "userId" : "6394e22877a382e42b5302a9", "uid" : "6417b914191f75863db02ce6", "textContent" : "hlo 87", "isSent" : false, "isSeen" : false, "isRead" : true, "email" : "demo@mymanager.com", "time" : "3/19/2023, 11:06:02 PM", "createdAt" : { "$date" : "2023-03-20T03:06:02.279+0000" }, "updatedAt" : { "$date" : "2023-04-28T12:20:39.720+0000" }, "__v" : 0 },
{ "_id" : { "$oid" : "6417cdaf191f75863db0c4ad" }, "userId" : "6394e22877a382e42b5302a9", "uid" : "6417b914191f75863db02ce6", "textContent" : "hii", "isSent" : false, "isSeen" : false, "isRead" : true, "email" : "demo@mymanager.com", "time" : "3/19/2023, 11:06:23 PM", "createdAt" : { "$date" : "2023-03-20T03:06:23.777+0000" }, "updatedAt" : { "$date" : "2023-04-28T12:20:39.720+0000" }, "__v" : 0 },
{ "_id" : { "$oid" : "6417ce6a191f75863db0c5db" }, "userId" : "6394e22877a382e42b5302a9", "uid" : "6417b914191f75863db02ce6", "textContent" : "hlo 88", "isSent" : false, "isSeen" : false, "isRead" : true, "email" : "demo@mymanager.com", "time" : "3/19/2023, 11:09:30 PM", "createdAt" : { "$date" : "2023-03-20T03:09:30.093+0000" }, "updatedAt" : { "$date" : "2023-04-28T12:20:39.720+0000" }, "__v" : 0 },
{ "_id" : { "$oid" : "6417ce9d191f75863db0c73b" }, "userId" : "6394e22877a382e42b5302a9", "uid" : "6417b914191f75863db02ce6", "textContent" : "hi 85", "isSent" : false, "isSeen" : false, "isRead" : true, "email" : "demo@mymanager.com", "time" : "3/19/2023, 11:10:21 PM", "createdAt" : { "$date" : "2023-03-20T03:10:21.653+0000" }, "updatedAt" : { "$date" : "2023-04-28T12:20:39.720+0000" }, "__v" : 0 },
{ "_id" : { "$oid" : "641c245eeea9f17fccbd8157" }, "userId" : "6394e22877a382e42b5302a9", "uid" : "6417b914191f75863db02ce6", "textContent" : "hi", "isSent" : true, "isSeen" : false, "isRead" : true, "email" : "demo@mymanager.com", "time" : "3/23/2023, 6:05:18 AM", "createdAt" : { "$date" : "2023-03-23T10:05:18.384+0000" }, "updatedAt" : { "$date" : "2023-04-28T12:20:39.720+0000" }, "__v" : 0 },
{ "_id" : { "$oid" : "641c246ceea9f17fccbd8162" }, "userId" : "6394e22877a382e42b5302a9", "uid" : "6417b914191f75863db02ce6", "textContent" : "hlo", "isSent" : false, "isSeen" : false, "isRead" : true, "email" : "demo@mymanager.com", "time" : "3/23/2023, 6:05:32 AM", "createdAt" : { "$date" : "2023-03-23T10:05:32.942+0000" }, "updatedAt" : { "$date" : "2023-04-28T12:20:39.720+0000" }, "__v" : 0 },
{ "_id" : { "$oid" : "641c24b0eea9f17fccbd81ba" }, "userId" : "6394e22877a382e42b5302a9", "uid" : "6417b914191f75863db02ce6", "textContent" : "hi", "isSent" : false, "isSeen" : false, "isRead" : true, "email" : "demo@mymanager.com", "time" : "3/23/2023, 6:06:40 AM", "createdAt" : { "$date" : "2023-03-23T10:06:40.441+0000" }, "updatedAt" : { "$date" : "2023-04-28T12:20:39.720+0000" }, "__v" : 0 },
{ "_id" : { "$oid" : "641c24c2eea9f17fccbd82d7" }, "userId" : "6394e22877a382e42b5302a9", "uid" : "6417b914191f75863db02ce6", "textContent" : "hlo", "isSent" : false, "isSeen" : false, "isRead" : true, "email" : "demo@mymanager.com", "time" : "3/23/2023, 6:06:58 AM", "createdAt" : { "$date" : "2023-03-23T10:06:58.850+0000" }, "updatedAt" : { "$date" : "2023-04-28T12:20:39.720+0000" }, "__v" : 0 },
{ "_id" : { "$oid" : "641c24edeea9f17fccbd83f4" }, "userId" : "6394e22877a382e42b5302a9", "uid" : "6417b914191f75863db02ce6", "textContent" : "hi", "isSent" : false, "isSeen" : false, "isRead" : true, "email" : "demo@mymanager.com", "time" : "3/23/2023, 6:07:41 AM", "createdAt" : { "$date" : "2023-03-23T10:07:41.997+0000" }, "updatedAt" : { "$date" : "2023-04-28T12:20:39.720+0000" }, "__v" : 0 },
{ "_id" : { "$oid" : "641c2550eea9f17fccbd8513" }, "userId" : "6394e22877a382e42b5302a9", "uid" : "6417b914191f75863db02ce6", "textContent" : "hi", "isSent" : false, "isSeen" : false, "isRead" : true, "email" : "demo@mymanager.com", "time" : "3/23/2023, 6:09:20 AM", "createdAt" : { "$date" : "2023-03-23T10:09:20.037+0000" }, "updatedAt" : { "$date" : "2023-04-28T12:20:39.720+0000" }, "__v" : 0 },
{ "_id" : { "$oid" : "641c2570eea9f17fccbd8567" }, "userId" : "6394e22877a382e42b5302a9", "uid" : "6417b914191f75863db02ce6", "textContent" : "hi", "isSent" : false, "isSeen" : false, "isRead" : true, "email" : "demo@mymanager.com", "time" : "3/23/2023, 6:09:52 AM", "createdAt" : { "$date" : "2023-03-23T10:09:52.783+0000" }, "updatedAt" : { "$date" : "2023-04-28T12:20:39.720+0000" }, "__v" : 0 },
{ "_id" : { "$oid" : "641c26d0eea9f17fccbd868e" }, "userId" : "6394e22877a382e42b5302a9", "uid" : "6417b914191f75863db02ce6", "textContent" : "hi", "isSent" : false, "isSeen" : false, "isRead" : true, "email" : "demo@mymanager.com", "time" : "3/23/2023, 6:15:44 AM", "createdAt" : { "$date" : "2023-03-23T10:15:44.818+0000" }, "updatedAt" : { "$date" : "2023-04-28T12:20:39.720+0000" }, "__v" : 0 },
{ "_id" : { "$oid" : "641c27c2eea9f17fccbd88ac" }, "userId" : "6394e22877a382e42b5302a9", "uid" : "6417b914191f75863db02ce6", "textContent" : "hi", "isSent" : false, "isSeen" : false, "isRead" : true, "email" : "demo@mymanager.com", "time" : "3/23/2023, 6:19:46 AM", "createdAt" : { "$date" : "2023-03-23T10:19:46.678+0000" }, "updatedAt" : { "$date" : "2023-04-28T12:20:39.720+0000" }, "__v" : 0 },
{ "_id" : { "$oid" : "641c2881eea9f17fccbd8b88" }, "userId" : "6394e22877a382e42b5302a9", "uid" : "641c2868eea9f17fccbd8932", "textContent" : "hi", "isSent" : true, "isSeen" : false, "isRead" : true, "email" : "test+90@mymanager.com", "time" : "3/23/2023, 6:22:57 AM", "createdAt" : { "$date" : "2023-03-23T10:22:57.607+0000" }, "updatedAt" : { "$date" : "2023-04-28T12:20:37.649+0000" }, "__v" : 0 },
{ "_id" : { "$oid" : "641c289aeea9f17fccbd8c60" }, "userId" : "6394e22877a382e42b5302a9", "uid" : "6417b914191f75863db02ce6", "textContent" : "hlo", "isSent" : false, "isSeen" : false, "isRead" : true, "email" : "demo@mymanager.com", "time" : "3/23/2023, 6:23:22 AM", "createdAt" : { "$date" : "2023-03-23T10:23:22.711+0000" }, "updatedAt" : { "$date" : "2023-04-28T12:20:39.720+0000" }, "__v" : 0 },
{ "_id" : { "$oid" : "641c28c8eea9f17fccbd8cc0" }, "userId" : "6394e22877a382e42b5302a9", "uid" : "6417b914191f75863db02ce6", "textContent" : "hi", "isSent" : false, "isSeen" : false, "isRead" : true, "email" : "demo@mymanager.com", "time" : "3/23/2023, 6:24:08 AM", "createdAt" : { "$date" : "2023-03-23T10:24:08.314+0000" }, "updatedAt" : { "$date" : "2023-04-28T12:20:39.720+0000" }, "__v" : 0 },
{ "_id" : { "$oid" : "641c2934eea9f17fccbd8ded" }, "userId" : "6394e22877a382e42b5302a9", "uid" : "6417b914191f75863db02ce6", "textContent" : "hi", "isSent" : false, "isSeen" : false, "isRead" : true, "email" : "demo@mymanager.com", "time" : "3/23/2023, 6:25:56 AM", "createdAt" : { "$date" : "2023-03-23T10:25:56.477+0000" }, "updatedAt" : { "$date" : "2023-04-28T12:20:39.720+0000" }, "__v" : 0 },
{ "_id" : { "$oid" : "641c2994eea9f17fccbd8e63" }, "userId" : "6394e22877a382e42b5302a9", "uid" : "6417b914191f75863db02ce6", "textContent" : "hi", "isSent" : false, "isSeen" : false, "isRead" : true, "email" : "demo@mymanager.com", "time" : "3/23/2023, 6:27:32 AM", "createdAt" : { "$date" : "2023-03-23T10:27:32.581+0000" }, "updatedAt" : { "$date" : "2023-04-28T12:20:39.720+0000" }, "__v" : 0 },
{ "_id" : { "$oid" : "641c2a68eea9f17fccbd92da" }, "userId" : "6394e22877a382e42b5302a9", "uid" : "6417b914191f75863db02ce6", "textContent" : "hi", "isSent" : false, "isSeen" : false, "isRead" : true, "email" : "demo@mymanager.com", "time" : "3/23/2023, 6:31:04 AM", "createdAt" : { "$date" : "2023-03-23T10:31:04.258+0000" }, "updatedAt" : { "$date" : "2023-04-28T12:20:39.720+0000" }, "__v" : 0 },
{ "_id" : { "$oid" : "641c2af2eea9f17fccbd940f" }, "userId" : "6394e22877a382e42b5302a9", "uid" : "6417b914191f75863db02ce6", "textContent" : "hi", "isSent" : false, "isSeen" : false, "isRead" : true, "email" : "demo@mymanager.com", "time" : "3/23/2023, 6:33:22 AM", "createdAt" : { "$date" : "2023-03-23T10:33:22.927+0000" }, "updatedAt" : { "$date" : "2023-04-28T12:20:39.720+0000" }, "__v" : 0 },
{ "_id" : { "$oid" : "641c2e7beea9f17fccbd9773" }, "userId" : "6394e22877a382e42b5302a9", "uid" : "6417b914191f75863db02ce6", "textContent" : "hi", "isSent" : false, "isSeen" : false, "isRead" : true, "email" : "demo@mymanager.com", "time" : "3/23/2023, 6:48:27 AM", "createdAt" : { "$date" : "2023-03-23T10:48:27.855+0000" }, "updatedAt" : { "$date" : "2023-04-28T12:20:39.720+0000" }, "__v" : 0 },
{ "_id" : { "$oid" : "641c2e8feea9f17fccbd97cf" }, "userId" : "6394e22877a382e42b5302a9", "uid" : "6417b914191f75863db02ce6", "textContent" : "hlo", "isSent" : false, "isSeen" : false, "isRead" : true, "email" : "demo@mymanager.com", "time" : "3/23/2023, 6:48:47 AM", "createdAt" : { "$date" : "2023-03-23T10:48:47.883+0000" }, "updatedAt" : { "$date" : "2023-04-28T12:20:39.720+0000" }, "__v" : 0 },
{ "_id" : { "$oid" : "641c2e9eeea9f17fccbd982b" }, "userId" : "6394e22877a382e42b5302a9", "uid" : "6417b914191f75863db02ce6", "textContent" : "hi", "isSent" : false, "isSeen" : false, "isRead" : true, "email" : "demo@mymanager.com", "time" : "3/23/2023, 6:49:02 AM", "createdAt" : { "$date" : "2023-03-23T10:49:02.260+0000" }, "updatedAt" : { "$date" : "2023-04-28T12:20:39.720+0000" }, "__v" : 0 },
{ "_id" : { "$oid" : "641c2ee2eea9f17fccbd995a" }, "userId" : "6394e22877a382e42b5302a9", "uid" : "6417b914191f75863db02ce6", "textContent" : "hlo 98", "isSent" : false, "isSeen" : false, "isRead" : true, "email" : "demo@mymanager.com", "time" : "3/23/2023, 6:50:10 AM", "createdAt" : { "$date" : "2023-03-23T10:50:10.903+0000" }, "updatedAt" : { "$date" : "2023-04-28T12:20:39.720+0000" }, "__v" : 0 },
{ "_id" : { "$oid" : "641c2eeceea9f17fccbd99b6" }, "userId" : "6394e22877a382e42b5302a9", "uid" : "6417b914191f75863db02ce6", "textContent" : "hlo 96", "isSent" : false, "isSeen" : false, "isRead" : true, "email" : "demo@mymanager.com", "time" : "3/23/2023, 6:50:20 AM", "createdAt" : { "$date" : "2023-03-23T10:50:20.662+0000" }, "updatedAt" : { "$date" : "2023-04-28T12:20:39.720+0000" }, "__v" : 0 },
{ "_id" : { "$oid" : "641c2ef9eea9f17fccbd9a14" }, "userId" : "6394e22877a382e42b5302a9", "uid" : "6417b914191f75863db02ce6", "textContent" : "hi", "isSent" : false, "isSeen" : false, "isRead" : true, "email" : "demo@mymanager.com", "time" : "3/23/2023, 6:50:33 AM", "createdAt" : { "$date" : "2023-03-23T10:50:33.867+0000" }, "updatedAt" : { "$date" : "2023-04-28T12:20:39.720+0000" }, "__v" : 0 },
{ "_id" : { "$oid" : "641c2f05eea9f17fccbd9a70" }, "userId" : "6394e22877a382e42b5302a9", "uid" : "641c2868eea9f17fccbd8932", "textContent" : "hlo 78", "isSent" : true, "isSeen" : false, "isRead" : true, "email" : "test+90@mymanager.com", "time" : "3/23/2023, 6:50:45 AM", "createdAt" : { "$date" : "2023-03-23T10:50:45.692+0000" }, "updatedAt" : { "$date" : "2023-04-28T12:20:37.649+0000" }, "__v" : 0 },
{ "_id" : { "$oid" : "641c2f15eea9f17fccbd9b48" }, "userId" : "6394e22877a382e42b5302a9", "uid" : "6417b914191f75863db02ce6", "textContent" : "hi88", "isSent" : false, "isSeen" : false, "isRead" : true, "email" : "demo@mymanager.com", "time" : "3/23/2023, 6:51:01 AM", "createdAt" : { "$date" : "2023-03-23T10:51:01.298+0000" }, "updatedAt" : { "$date" : "2023-04-28T12:20:39.720+0000" }, "__v" : 0 },
{ "_id" : { "$oid" : "641c2f1deea9f17fccbd9ba4" }, "userId" : "6394e22877a382e42b5302a9", "uid" : "6417b914191f75863db02ce6", "textContent" : "hlo 98", "isSent" : false, "isSeen" : false, "isRead" : true, "email" : "demo@mymanager.com", "time" : "3/23/2023, 6:51:09 AM", "createdAt" : { "$date" : "2023-03-23T10:51:09.700+0000" }, "updatedAt" : { "$date" : "2023-04-28T12:20:39.720+0000" }, "__v" : 0 },
{ "_id" : { "$oid" : "641c3556eea9f17fccbd9f4f" }, "userId" : "6394e22877a382e42b5302a9", "uid" : "641c2868eea9f17fccbd8932", "textContent" : "hi 44", "isSent" : true, "isSeen" : false, "isRead" : true, "email" : "test+90@mymanager.com", "time" : "3/23/2023, 7:17:42 AM", "createdAt" : { "$date" : "2023-03-23T11:17:42.401+0000" }, "updatedAt" : { "$date" : "2023-04-28T12:20:37.649+0000" }, "__v" : 0 },
{ "_id" : { "$oid" : "641c3647eea9f17fccbda0e7" }, "userId" : "6394e22877a382e42b5302a9", "uid" : "6417b914191f75863db02ce6", "textContent" : "hi", "isSent" : false, "isSeen" : false, "isRead" : true, "email" : "demo@mymanager.com", "time" : "3/23/2023, 7:21:43 AM", "createdAt" : { "$date" : "2023-03-23T11:21:43.328+0000" }, "updatedAt" : { "$date" : "2023-04-28T12:20:39.720+0000" }, "__v" : 0 },
{ "_id" : { "$oid" : "641c3652eea9f17fccbda147" }, "userId" : "6394e22877a382e42b5302a9", "uid" : "6417b914191f75863db02ce6", "textContent" : "hlo 98", "isSent" : false, "isSeen" : false, "isRead" : true, "email" : "demo@mymanager.com", "time" : "3/23/2023, 7:21:54 AM", "createdAt" : { "$date" : "2023-03-23T11:21:54.338+0000" }, "updatedAt" : { "$date" : "2023-04-28T12:20:39.720+0000" }, "__v" : 0 },
{ "_id" : { "$oid" : "641c3658eea9f17fccbda1a3" }, "userId" : "6394e22877a382e42b5302a9", "uid" : "6417b914191f75863db02ce6", "textContent" : "bye", "isSent" : false, "isSeen" : false, "isRead" : true, "email" : "demo@mymanager.com", "time" : "3/23/2023, 7:22:00 AM", "createdAt" : { "$date" : "2023-03-23T11:22:00.513+0000" }, "updatedAt" : { "$date" : "2023-04-28T12:20:39.720+0000" }, "__v" : 0 },
{ "_id" : { "$oid" : "641d7984172b8504f12d9f90" }, "userId" : "6394e22877a382e42b5302a9", "uid" : "6417b914191f75863db02ce6", "textContent" : "hi", "isSent" : true, "isSeen" : false, "isRead" : true, "email" : "demo@mymanager.com", "time" : "3/24/2023, 6:20:52 AM", "createdAt" : { "$date" : "2023-03-24T10:20:52.766+0000" }, "updatedAt" : { "$date" : "2023-04-28T12:20:39.720+0000" }, "__v" : 0 },
{ "_id" : { "$oid" : "641d79f2172b8504f12da26e" }, "userId" : "6394e22877a382e42b5302a9", "uid" : "6417b914191f75863db02ce6", "textContent" : "helo 98", "isSent" : false, "isSeen" : false, "isRead" : true, "email" : "demo@mymanager.com", "time" : "3/24/2023, 6:22:42 AM", "createdAt" : { "$date" : "2023-03-24T10:22:42.647+0000" }, "updatedAt" : { "$date" : "2023-04-28T12:20:39.720+0000" }, "__v" : 0 },
{ "_id" : { "$oid" : "641d7a1b172b8504f12da422" }, "userId" : "6394e22877a382e42b5302a9", "uid" : "6417b914191f75863db02ce6", "textContent" : "helo 97", "isSent" : false, "isSeen" : false, "isRead" : true, "email" : "demo@mymanager.com", "time" : "3/24/2023, 6:23:23 AM", "createdAt" : { "$date" : "2023-03-24T10:23:23.874+0000" }, "updatedAt" : { "$date" : "2023-04-28T12:20:39.720+0000" }, "__v" : 0 },
{ "_id" : { "$oid" : "641d7a2c172b8504f12da43c" }, "userId" : "6394e22877a382e42b5302a9", "uid" : "6417b914191f75863db02ce6", "textContent" : "helo 95", "isSent" : false, "isSeen" : false, "isRead" : true, "email" : "demo@mymanager.com", "time" : "3/24/2023, 6:23:40 AM", "createdAt" : { "$date" : "2023-03-24T10:23:40.528+0000" }, "updatedAt" : { "$date" : "2023-04-28T12:20:39.720+0000" }, "__v" : 0 },
{ "_id" : { "$oid" : "641d7a34172b8504f12da450" }, "userId" : "6394e22877a382e42b5302a9", "uid" : "641c2868eea9f17fccbd8932", "textContent" : "hi", "isSent" : true, "isSeen" : false, "isRead" : true, "email" : "test+90@mymanager.com", "time" : "3/24/2023, 6:23:48 AM", "createdAt" : { "$date" : "2023-03-24T10:23:48.062+0000" }, "updatedAt" : { "$date" : "2023-04-28T12:20:37.649+0000" }, "__v" : 0 },
{ "_id" : { "$oid" : "641d7a43172b8504f12da525" }, "userId" : "6394e22877a382e42b5302a9", "uid" : "6417b914191f75863db02ce6", "textContent" : "helo 99", "isSent" : false, "isSeen" : false, "isRead" : true, "email" : "demo@mymanager.com", "time" : "3/24/2023, 6:24:03 AM", "createdAt" : { "$date" : "2023-03-24T10:24:03.180+0000" }, "updatedAt" : { "$date" : "2023-04-28T12:20:39.720+0000" }, "__v" : 0 },
{ "_id" : { "$oid" : "641d7a4e172b8504f12da53d" }, "userId" : "6394e22877a382e42b5302a9", "uid" : "6417b914191f75863db02ce6", "textContent" : "helo helo", "isSent" : false, "isSeen" : false, "isRead" : true, "email" : "demo@mymanager.com", "time" : "3/24/2023, 6:24:14 AM", "createdAt" : { "$date" : "2023-03-24T10:24:14.403+0000" }, "updatedAt" : { "$date" : "2023-04-28T12:20:39.720+0000" }, "__v" : 0 },
{ "_id" : { "$oid" : "641d9110b54db86ca25cc4d0" }, "userId" : "6394e22877a382e42b5302a9", "uid" : "63f83dc8b535a7e0062d0fb6", "textContent" : "test", "isSent" : true, "isSeen" : false, "isRead" : true, "email" : "bisharat.akram1999@gmail.com", "time" : "3/24/2023, 8:01:20 AM", "createdAt" : { "$date" : "2023-03-24T12:01:20.347+0000" }, "updatedAt" : { "$date" : "2023-04-27T02:56:19.938+0000" }, "__v" : 0 },
{ "_id" : { "$oid" : "641d913ab54db86ca25cc65d" }, "userId" : "6394e22877a382e42b5302a9", "uid" : "6402399fed47ecfdd68174cc", "textContent" : "Sd", "isSent" : false, "isSeen" : false, "isRead" : true, "email" : "ceo@gmail.com", "time" : "3/24/2023, 8:02:02 AM", "createdAt" : { "$date" : "2023-03-24T12:02:02.698+0000" }, "updatedAt" : { "$date" : "2023-04-27T02:55:46.770+0000" }, "__v" : 0 },
{ "_id" : { "$oid" : "641d9147b54db86ca25cc6ce" }, "userId" : "6394e22877a382e42b5302a9", "uid" : "6402399fed47ecfdd68174cc", "textContent" : "Gfdf", "isSent" : false, "isSeen" : false, "isRead" : true, "email" : "ceo@gmail.com", "time" : "3/24/2023, 8:02:15 AM", "createdAt" : { "$date" : "2023-03-24T12:02:15.628+0000" }, "updatedAt" : { "$date" : "2023-04-27T02:55:46.770+0000" }, "__v" : 0 },
{ "_id" : { "$oid" : "6421c3d3c75cc6cc72aa0a5f" }, "userId" : "6394e22877a382e42b5302a9", "uid" : "6417b914191f75863db02ce6", "textContent" : "hi", "isSent" : true, "isSeen" : false, "isRead" : true, "email" : "demo@mymanager.com", "time" : "3/27/2023, 12:26:59 PM", "createdAt" : { "$date" : "2023-03-27T16:26:59.529+0000" }, "updatedAt" : { "$date" : "2023-04-28T12:20:39.720+0000" }, "__v" : 0 },
{ "_id" : { "$oid" : "6421c536c75cc6cc72aa0a6a" }, "userId" : "6394e22877a382e42b5302a9", "uid" : "6417b914191f75863db02ce6", "textContent" : "helo", "isSent" : false, "isSeen" : false, "isRead" : true, "email" : "demo@mymanager.com", "time" : "3/27/2023, 12:32:54 PM", "createdAt" : { "$date" : "2023-03-27T16:32:54.692+0000" }, "updatedAt" : { "$date" : "2023-04-28T12:20:39.720+0000" }, "__v" : 0 },
{ "_id" : { "$oid" : "6421c55bc75cc6cc72aa0b44" }, "userId" : "6394e22877a382e42b5302a9", "uid" : "6417b914191f75863db02ce6", "textContent" : "hi", "isSent" : false, "isSeen" : false, "isRead" : true, "email" : "demo@mymanager.com", "time" : "3/27/2023, 12:33:31 PM", "createdAt" : { "$date" : "2023-03-27T16:33:31.281+0000" }, "updatedAt" : { "$date" : "2023-04-28T12:20:39.720+0000" }, "__v" : 0 },
{ "_id" : { "$oid" : "6421c57bc75cc6cc72aa0c1c" }, "userId" : "6394e22877a382e42b5302a9", "uid" : "6417b914191f75863db02ce6", "textContent" : "hlo", "isSent" : false, "isSeen" : false, "isRead" : true, "email" : "demo@mymanager.com", "time" : "3/27/2023, 12:34:03 PM", "createdAt" : { "$date" : "2023-03-27T16:34:03.133+0000" }, "updatedAt" : { "$date" : "2023-04-28T12:20:39.720+0000" }, "__v" : 0 },
{ "_id" : { "$oid" : "6421f04985f36468b68db8f7" }, "userId" : "6394e22877a382e42b5302a9", "uid" : "6417b914191f75863db02ce6", "textContent" : "wwww", "isSent" : true, "isSeen" : false, "isRead" : true, "email" : "demo@mymanager.com", "time" : "3/27/2023, 3:36:41 PM", "createdAt" : { "$date" : "2023-03-27T19:36:41.425+0000" }, "updatedAt" : { "$date" : "2023-04-28T12:20:39.720+0000" }, "__v" : 0 },
{ "_id" : { "$oid" : "6424852ccdf40070d3b1bb26" }, "userId" : "6394e22877a382e42b5302a9", "uid" : "63f6de5cbb79d4324b805cf1", "textContent" : "hello", "isSent" : true, "isSeen" : false, "isRead" : true, "email" : "test@mymanager.com", "time" : "3/29/2023, 2:36:28 PM", "createdAt" : { "$date" : "2023-03-29T18:36:28.730+0000" }, "updatedAt" : { "$date" : "2023-04-28T12:20:38.821+0000" }, "__v" : 0 },
{ "_id" : { "$oid" : "6424ca476d31218ca9de4cb1" }, "userId" : "6394e22877a382e42b5302a9", "uid" : "63f6de5cbb79d4324b805cf1", "textContent" : "s", "isSent" : true, "isSeen" : false, "isRead" : true, "email" : "test@mymanager.com", "time" : "3/29/2023, 7:31:19 PM", "createdAt" : { "$date" : "2023-03-29T23:31:19.818+0000" }, "updatedAt" : { "$date" : "2023-04-28T12:20:38.821+0000" }, "__v" : 0 },
{ "_id" : { "$oid" : "6424ca4d6d31218ca9de4cb8" }, "userId" : "6394e22877a382e42b5302a9", "uid" : "63f6de5cbb79d4324b805cf1", "textContent" : "12", "isSent" : true, "isSeen" : false, "isRead" : true, "email" : "test@mymanager.com", "time" : "3/29/2023, 7:31:25 PM", "createdAt" : { "$date" : "2023-03-29T23:31:25.816+0000" }, "updatedAt" : { "$date" : "2023-04-28T12:20:38.821+0000" }, "__v" : 0 },
{ "_id" : { "$oid" : "6424ce136d31218ca9de4f28" }, "userId" : "6394e22877a382e42b5302a9", "uid" : "63f6de5cbb79d4324b805cf1", "textContent" : "Please send me sms", "isSent" : true, "isSeen" : false, "isRead" : true, "email" : "test@mymanager.com", "time" : "3/29/2023, 7:47:31 PM", "createdAt" : { "$date" : "2023-03-29T23:47:31.374+0000" }, "updatedAt" : { "$date" : "2023-04-28T12:20:38.821+0000" }, "__v" : 0 },
{ "_id" : { "$oid" : "6424d03d6d31218ca9de4f31" }, "userId" : "6394e22877a382e42b5302a9", "uid" : "63f6de5cbb79d4324b805cf1", "textContent" : "Hello", "isSent" : false, "isSeen" : false, "isRead" : true, "email" : "test@mymanager.com", "time" : "3/29/2023, 7:56:45 PM", "createdAt" : { "$date" : "2023-03-29T23:56:45.338+0000" }, "updatedAt" : { "$date" : "2023-04-28T12:20:38.821+0000" }, "__v" : 0 },
{ "_id" : { "$oid" : "6424dfd66d31218ca9de5888" }, "userId" : "6394e22877a382e42b5302a9", "uid" : "63f6de5cbb79d4324b805cf1", "textContent" : "hi", "isSent" : true, "isSeen" : false, "isRead" : true, "email" : "xing.liao724@gmail.com", "time" : "3/29/2023, 9:03:18 PM", "createdAt" : { "$date" : "2023-03-30T01:03:18.449+0000" }, "updatedAt" : { "$date" : "2023-04-28T12:20:38.821+0000" }, "__v" : 0 },
{ "_id" : { "$oid" : "6424e1326d31218ca9de5b2e" }, "userId" : "63e46f6673473f895555d907", "uid" : "63f0d26574402c6dfa121f1e", "textContent" : "hei", "isSent" : true, "isSeen" : false, "isRead" : true, "email" : "ceo@clintonoh.com", "time" : "3/29/2023, 9:09:06 PM", "createdAt" : { "$date" : "2023-03-30T01:09:06.238+0000" }, "updatedAt" : { "$date" : "2023-05-09T10:48:16.758+0000" }, "__v" : 0 },
{ "_id" : { "$oid" : "6424e1426d31218ca9de5b42" }, "userId" : "6394e22877a382e42b5302a9", "uid" : "63f6de5cbb79d4324b805cf1", "textContent" : "hello", "isSent" : true, "isSeen" : false, "isRead" : true, "email" : "xing.liao724@gmail.com", "time" : "3/29/2023, 9:09:22 PM", "createdAt" : { "$date" : "2023-03-30T01:09:22.770+0000" }, "updatedAt" : { "$date" : "2023-04-28T12:20:38.821+0000" }, "__v" : 0 },
{ "_id" : { "$oid" : "6424e2b76d31218ca9de5dd0" }, "userId" : "6394e22877a382e42b5302a9", "uid" : "63f6de5cbb79d4324b805cf1", "textContent" : "hihihi", "isSent" : true, "isSeen" : false, "isRead" : true, "email" : "xing.liao724@gmail.com", "time" : "3/29/2023, 9:15:35 PM", "createdAt" : { "$date" : "2023-03-30T01:15:35.430+0000" }, "updatedAt" : { "$date" : "2023-04-28T12:20:38.821+0000" }, "__v" : 0 },
{ "_id" : { "$oid" : "6424e5a76d31218ca9de6642" }, "userId" : "6394e22877a382e42b5302a9", "uid" : "63f6de5cbb79d4324b805cf1", "textContent" : "os", "isSent" : true, "isSeen" : false, "isRead" : true, "email" : "xing.liao724@gmail.com", "time" : "3/29/2023, 9:28:07 PM", "createdAt" : { "$date" : "2023-03-30T01:28:07.201+0000" }, "updatedAt" : { "$date" : "2023-04-28T12:20:38.821+0000" }, "__v" : 0 },
{ "_id" : { "$oid" : "6424fbb46d31218ca9de7896" }, "userId" : "6394e22877a382e42b5302a9", "uid" : "63f6de5cbb79d4324b805cf1", "textContent" : "hi", "isSent" : false, "isSeen" : false, "isRead" : true, "email" : "xing.liao724@gmail.com", "time" : "3/29/2023, 11:02:12 PM", "createdAt" : { "$date" : "2023-03-30T03:02:12.636+0000" }, "updatedAt" : { "$date" : "2023-04-28T12:20:38.821+0000" }, "__v" : 0 },
{ "_id" : { "$oid" : "642504646d31218ca9de7cca" }, "userId" : "63e46f6673473f895555d907", "uid" : "641299f6f09d15a4238aa5ca", "textContent" : "hi", "isSent" : true, "isSeen" : false, "isRead" : true, "email" : "aaa@gmail.com", "time" : "3/29/2023, 11:39:16 PM", "createdAt" : { "$date" : "2023-03-30T03:39:16.382+0000" }, "updatedAt" : { "$date" : "2023-05-06T10:27:34.282+0000" }, "__v" : 0 },
{ "_id" : { "$oid" : "6425046f6d31218ca9de7cd3" }, "userId" : "63e46f6673473f895555d907", "uid" : "641299f6f09d15a4238aa5ca", "textContent" : "ok", "isSent" : false, "isSeen" : false, "isRead" : true, "email" : "aaa@gmail.com", "time" : "3/29/2023, 11:39:27 PM", "createdAt" : { "$date" : "2023-03-30T03:39:27.653+0000" }, "updatedAt" : { "$date" : "2023-05-06T10:27:34.282+0000" }, "__v" : 0 },
{ "_id" : { "$oid" : "642545daa9295542b3bf229a" }, "userId" : "63e46f6673473f895555d907", "uid" : "641299f6f09d15a4238aa5ca", "textContent" : "Hello, This is for check2", "isSent" : true, "isSeen" : false, "isRead" : true, "email" : "aaa@gmail.com", "time" : "3/30/2023, 4:18:34 AM", "createdAt" : { "$date" : "2023-03-30T08:18:34.720+0000" }, "updatedAt" : { "$date" : "2023-05-06T10:27:34.282+0000" }, "__v" : 0 },
{ "_id" : { "$oid" : "64254709a9295542b3bf22a5" }, "userId" : "63e46f6673473f895555d907", "uid" : "641299f6f09d15a4238aa5ca", "textContent" : "hi", "isSent" : false, "isSeen" : false, "isRead" : true, "email" : "aaa@gmail.com", "time" : "3/30/2023, 4:23:37 AM", "createdAt" : { "$date" : "2023-03-30T08:23:37.126+0000" }, "updatedAt" : { "$date" : "2023-05-06T10:27:34.282+0000" }, "__v" : 0 },
{ "_id" : { "$oid" : "642547aab12ca35a2ce976db" }, "userId" : "63e46f6673473f895555d907", "uid" : "641299f6f09d15a4238aa5ca", "textContent" : "hi", "isSent" : false, "isSeen" : false, "isRead" : true, "email" : "aaa@gmail.com", "time" : "3/30/2023, 4:26:18 AM", "createdAt" : { "$date" : "2023-03-30T08:26:18.593+0000" }, "updatedAt" : { "$date" : "2023-05-06T10:27:34.282+0000" }, "__v" : 0 },
{ "_id" : { "$oid" : "6425da1bb0bfce84725ce39d" }, "userId" : "63e46f6673473f895555d907", "uid" : "63f0d26574402c6dfa121f1e", "textContent" : "This is body part", "isSent" : false, "isSeen" : false, "isRead" : true, "email" : "ceo@clintonoh.com", "time" : "3/30/2023, 2:51:07 PM", "createdAt" : { "$date" : "2023-03-30T18:51:07.176+0000" }, "updatedAt" : { "$date" : "2023-05-09T10:48:16.758+0000" }, "__v" : 0 },
{ "_id" : { "$oid" : "6425dee9983ad9c01dcb5880" }, "userId" : "63e46f6673473f895555d907", "uid" : "63f0d26574402c6dfa121f1e", "textContent" : "This is body part", "isSent" : false, "isSeen" : false, "isRead" : true, "email" : "ceo@clintonoh.com", "time" : "3/30/2023, 3:11:37 PM", "createdAt" : { "$date" : "2023-03-30T19:11:37.525+0000" }, "updatedAt" : { "$date" : "2023-05-09T10:48:16.758+0000" }, "__v" : 0 },
{ "_id" : { "$oid" : "6425dfd0493d116b23c0169e" }, "userId" : "63e46f6673473f895555d907", "uid" : "63f0d26574402c6dfa121f1e", "textContent" : "This is body part", "isSent" : false, "isSeen" : false, "isRead" : true, "email" : "ceo@clintonoh.com", "time" : "3/30/2023, 3:15:28 PM", "createdAt" : { "$date" : "2023-03-30T19:15:28.354+0000" }, "updatedAt" : { "$date" : "2023-05-09T10:48:16.758+0000" }, "__v" : 0 },
{ "_id" : { "$oid" : "6425e15c3d22ed987019003a" }, "userId" : "63e46f6673473f895555d907", "uid" : "63f0d26574402c6dfa121f1e", "textContent" : "This is teset part", "isSent" : false, "isSeen" : false, "isRead" : true, "email" : "ceo@clintonoh.com", "time" : "3/30/2023, 3:22:04 PM", "createdAt" : { "$date" : "2023-03-30T19:22:04.419+0000" }, "updatedAt" : { "$date" : "2023-05-09T10:48:16.758+0000" }, "__v" : 0 },
{ "_id" : { "$oid" : "6425e1fb3edf53e558b77319" }, "userId" : "63e46f6673473f895555d907", "uid" : "63f0d26574402c6dfa121f1e", "textContent" : "This is test part", "isSent" : false, "isSeen" : false, "isRead" : true, "email" : "ceo@clintonoh.com", "time" : "3/30/2023, 3:24:43 PM", "createdAt" : { "$date" : "2023-03-30T19:24:43.834+0000" }, "updatedAt" : { "$date" : "2023-05-09T10:48:16.758+0000" }, "__v" : 0 },
{ "_id" : { "$oid" : "6425e9103edf53e558b77c29" }, "userId" : "63e46f6673473f895555d907", "uid" : "63f0d26574402c6dfa121f1e", "textContent" : "This is test part", "isSent" : false, "isSeen" : false, "isRead" : true, "email" : "ceo@clintonoh.com", "time" : "3/30/2023, 3:54:56 PM", "createdAt" : { "$date" : "2023-03-30T19:54:56.810+0000" }, "updatedAt" : { "$date" : "2023-05-09T10:48:16.758+0000" }, "__v" : 0 },
{ "_id" : { "$oid" : "6425e9cd3edf53e558b77c42" }, "userId" : "63e46f6673473f895555d907", "uid" : "63f0d26574402c6dfa121f1e", "textContent" : "This is test part", "isSent" : false, "isSeen" : false, "isRead" : true, "email" : "ceo@clintonoh.com", "time" : "3/30/2023, 3:58:05 PM", "createdAt" : { "$date" : "2023-03-30T19:58:05.266+0000" }, "updatedAt" : { "$date" : "2023-05-09T10:48:16.758+0000" }, "__v" : 0 },
{ "_id" : { "$oid" : "6425ea05c2f082756331d59c" }, "userId" : "63e46f6673473f895555d907", "uid" : "63f0d26574402c6dfa121f1e", "textContent" : "  ", "isSent" : false, "isSeen" : false, "isRead" : true, "email" : "ceo@clintonoh.com", "time" : "3/30/2023, 3:59:01 PM", "createdAt" : { "$date" : "2023-03-30T19:59:01.988+0000" }, "updatedAt" : { "$date" : "2023-05-09T10:48:16.758+0000" }, "__v" : 0 },
{ "_id" : { "$oid" : "6425ebf33edf53e558b77e57" }, "userId" : "63e46f6673473f895555d907", "uid" : "63f0d26574402c6dfa121f1e", "textContent" : "This is test part", "isSent" : false, "isSeen" : false, "isRead" : true, "email" : "ceo@clintonoh.com", "time" : "3/30/2023, 4:07:15 PM", "createdAt" : { "$date" : "2023-03-30T20:07:15.484+0000" }, "updatedAt" : { "$date" : "2023-05-09T10:48:16.758+0000" }, "__v" : 0 },
{ "_id" : { "$oid" : "6425ec023edf53e558b77e8c" }, "userId" : "63e46f6673473f895555d907", "uid" : "63f0d26574402c6dfa121f1e", "textContent" : "This is test part", "isSent" : false, "isSeen" : false, "isRead" : true, "email" : "ceo@clintonoh.com", "time" : "3/30/2023, 4:07:30 PM", "createdAt" : { "$date" : "2023-03-30T20:07:30.242+0000" }, "updatedAt" : { "$date" : "2023-05-09T10:48:16.758+0000" }, "__v" : 0 },
{ "_id" : { "$oid" : "6425eeb13ee73ce0abe2a2b5" }, "userId" : "63e46f6673473f895555d907", "uid" : "63f0d26574402c6dfa121f1e", "textContent" : "This is test part", "isSent" : false, "isSeen" : false, "isRead" : true, "email" : "ceo@clintonoh.com", "time" : "3/30/2023, 4:18:57 PM", "createdAt" : { "$date" : "2023-03-30T20:18:57.559+0000" }, "updatedAt" : { "$date" : "2023-05-09T10:48:16.758+0000" }, "__v" : 0 },
{ "_id" : { "$oid" : "6425ef0e5535a4a51285d640" }, "userId" : "63e46f6673473f895555d907", "uid" : "63f0d26574402c6dfa121f1e", "textContent" : "This is test part", "isSent" : false, "isSeen" : false, "isRead" : true, "email" : "ceo@clintonoh.com", "time" : "3/30/2023, 4:20:30 PM", "createdAt" : { "$date" : "2023-03-30T20:20:30.734+0000" }, "updatedAt" : { "$date" : "2023-05-09T10:48:16.758+0000" }, "__v" : 0 },
{ "_id" : { "$oid" : "6426cc1623a5a26892a21d91" }, "userId" : "6394e22877a382e42b5302a9", "uid" : "63e4e483c230b663594ec375", "textContent" : "hello", "isSent" : true, "isSeen" : false, "isRead" : true, "email" : "Ceo@clintonoh.com", "time" : "3/31/2023, 8:03:34 AM", "createdAt" : { "$date" : "2023-03-31T12:03:34.123+0000" }, "updatedAt" : { "$date" : "2023-04-27T02:56:19.570+0000" }, "__v" : 0 },
{ "_id" : { "$oid" : "6426cc2023a5a26892a21d9c" }, "userId" : "6394e22877a382e42b5302a9", "uid" : "6402399fed47ecfdd68174cc", "textContent" : "Hi", "isSent" : false, "isSeen" : false, "isRead" : true, "email" : "ceo@gmail.com", "time" : "3/31/2023, 8:03:44 AM", "createdAt" : { "$date" : "2023-03-31T12:03:44.243+0000" }, "updatedAt" : { "$date" : "2023-04-27T02:55:46.770+0000" }, "__v" : 0 },
{ "_id" : { "$oid" : "6426cc2723a5a26892a21dd6" }, "userId" : "6394e22877a382e42b5302a9", "uid" : "6402399fed47ecfdd68174cc", "textContent" : "Hello", "isSent" : false, "isSeen" : false, "isRead" : true, "email" : "ceo@gmail.com", "time" : "3/31/2023, 8:03:51 AM", "createdAt" : { "$date" : "2023-03-31T12:03:51.700+0000" }, "updatedAt" : { "$date" : "2023-04-27T02:55:46.770+0000" }, "__v" : 0 },
{ "_id" : { "$oid" : "6427ee826bfb2d5f467aabdf" }, "userId" : "6394e22877a382e42b5302a9", "uid" : "6417b914191f75863db02ce6", "textContent" : "ef", "isSent" : true, "isSeen" : false, "isRead" : true, "email" : "demo@mymanager.com", "time" : "4/1/2023, 4:42:42 AM", "createdAt" : { "$date" : "2023-04-01T08:42:42.603+0000" }, "updatedAt" : { "$date" : "2023-04-28T12:20:39.720+0000" }, "__v" : 0 },
{ "_id" : { "$oid" : "6428a1ef0ce3a41fefddf201" }, "userId" : "6394e22877a382e42b5302a9", "uid" : "63f6de5cbb79d4324b805cf1", "textContent" : "hi", "isSent" : true, "isSeen" : false, "isRead" : true, "email" : "xing.liao724@gmail.com", "time" : "4/1/2023, 5:28:15 PM", "createdAt" : { "$date" : "2023-04-01T21:28:15.560+0000" }, "updatedAt" : { "$date" : "2023-04-28T12:20:38.821+0000" }, "__v" : 0 },
{ "_id" : { "$oid" : "6428a2569550d252a5a816c1" }, "userId" : "6394e22877a382e42b5302a9", "uid" : "63f6de5cbb79d4324b805cf1", "textContent" : "hi", "isSent" : true, "isSeen" : false, "isRead" : true, "email" : "xing.liao724@gmail.com", "time" : "4/1/2023, 5:29:58 PM", "createdAt" : { "$date" : "2023-04-01T21:29:58.599+0000" }, "updatedAt" : { "$date" : "2023-04-28T12:20:38.821+0000" }, "__v" : 0 },
{ "_id" : { "$oid" : "6428a2ab9550d252a5a816ca" }, "userId" : "6394e22877a382e42b5302a9", "uid" : "63f6de5cbb79d4324b805cf1", "textContent" : "Hello", "isSent" : true, "isSeen" : false, "isRead" : true, "email" : "xing.liao724@gmail.com", "time" : "4/1/2023, 5:31:23 PM", "createdAt" : { "$date" : "2023-04-01T21:31:23.050+0000" }, "updatedAt" : { "$date" : "2023-04-28T12:20:38.821+0000" }, "__v" : 0 },
{ "_id" : { "$oid" : "6428af71fb8a3455724ba67a" }, "userId" : "6394e22877a382e42b5302a9", "uid" : "63f6de5cbb79d4324b805cf1", "textContent" : "This is for test", "isSent" : true, "isSeen" : false, "isRead" : true, "email" : "xing.liao724@gmail.com", "time" : "4/1/2023, 6:25:53 PM", "createdAt" : { "$date" : "2023-04-01T22:25:53.177+0000" }, "updatedAt" : { "$date" : "2023-04-28T12:20:38.821+0000" }, "__v" : 0 },
{ "_id" : { "$oid" : "6428afb8fb8a3455724ba705" }, "userId" : "6394e22877a382e42b5302a9", "uid" : "63f6de5cbb79d4324b805cf1", "textContent" : "Hello", "isSent" : true, "isSeen" : false, "isRead" : true, "email" : "xing.liao724@gmail.com", "time" : "4/1/2023, 6:27:04 PM", "createdAt" : { "$date" : "2023-04-01T22:27:04.258+0000" }, "updatedAt" : { "$date" : "2023-04-28T12:20:38.821+0000" }, "__v" : 0 },
{ "_id" : { "$oid" : "6428b9ba4de5426b187a3f12" }, "userId" : "6394e22877a382e42b5302a9", "uid" : "63f6de5cbb79d4324b805cf1", "textContent" : "Hello this is waht", "isSent" : true, "isSeen" : false, "isRead" : true, "email" : "xing.liao724@gmail.com", "time" : "4/1/2023, 7:09:46 PM", "createdAt" : { "$date" : "2023-04-01T23:09:46.836+0000" }, "updatedAt" : { "$date" : "2023-04-28T12:20:38.821+0000" }, "__v" : 0 },
{ "_id" : { "$oid" : "6428cae0dca7a46077e6375e" }, "userId" : "6394e22877a382e42b5302a9", "uid" : "63f6de5cbb79d4324b805cf1", "textContent" : "hi", "isSent" : true, "isSeen" : false, "isRead" : true, "email" : "xing.liao724@gmail.com", "time" : "4/1/2023, 8:22:56 PM", "createdAt" : { "$date" : "2023-04-02T00:22:56.224+0000" }, "updatedAt" : { "$date" : "2023-04-28T12:20:38.821+0000" }, "__v" : 0 },
{ "_id" : { "$oid" : "6428caeadca7a46077e63767" }, "userId" : "6394e22877a382e42b5302a9", "uid" : "63f6de5cbb79d4324b805cf1", "textContent" : "Nice to meet you", "isSent" : true, "isSeen" : false, "isRead" : true, "email" : "xing.liao724@gmail.com", "time" : "4/1/2023, 8:23:06 PM", "createdAt" : { "$date" : "2023-04-02T00:23:06.139+0000" }, "updatedAt" : { "$date" : "2023-04-28T12:20:38.821+0000" }, "__v" : 0 },
{ "_id" : { "$oid" : "6428ce31ab0de793ffbed0bb" }, "userId" : "6394e22877a382e42b5302a9", "uid" : "6417b914191f75863db02ce6", "textContent" : "hi", "isSent" : true, "isSeen" : false, "isRead" : true, "email" : "demo@mymanager.com", "time" : "4/1/2023, 8:37:05 PM", "createdAt" : { "$date" : "2023-04-02T00:37:05.342+0000" }, "updatedAt" : { "$date" : "2023-04-28T12:20:39.720+0000" }, "__v" : 0 },
{ "_id" : { "$oid" : "6428ceac9457d5d1211a420b" }, "userId" : "6394e22877a382e42b5302a9", "uid" : "6417b914191f75863db02ce6", "textContent" : "hi", "isSent" : true, "isSeen" : false, "isRead" : true, "email" : "demo@mymanager.com", "time" : "4/1/2023, 8:39:08 PM", "createdAt" : { "$date" : "2023-04-02T00:39:08.244+0000" }, "updatedAt" : { "$date" : "2023-04-28T12:20:39.720+0000" }, "__v" : 0 },
{ "_id" : { "$oid" : "6428ced642fea47d3657041f" }, "userId" : "6394e22877a382e42b5302a9", "uid" : "6417b914191f75863db02ce6", "textContent" : "hello", "isSent" : true, "isSeen" : false, "isRead" : true, "email" : "demo@mymanager.com", "time" : "4/1/2023, 8:39:50 PM", "createdAt" : { "$date" : "2023-04-02T00:39:50.474+0000" }, "updatedAt" : { "$date" : "2023-04-28T12:20:39.720+0000" }, "__v" : 0 },
{ "_id" : { "$oid" : "6428cee242fea47d36570429" }, "userId" : "6394e22877a382e42b5302a9", "uid" : "6417b914191f75863db02ce6", "textContent" : "hi", "isSent" : true, "isSeen" : false, "isRead" : true, "email" : "demo@mymanager.com", "time" : "4/1/2023, 8:40:02 PM", "createdAt" : { "$date" : "2023-04-02T00:40:02.728+0000" }, "updatedAt" : { "$date" : "2023-04-28T12:20:39.720+0000" }, "__v" : 0 },
{ "_id" : { "$oid" : "6428ddc242fea47d365707de" }, "userId" : "6394e22877a382e42b5302a9", "uid" : "6417b914191f75863db02ce6", "textContent" : "ingo", "isSent" : true, "isSeen" : false, "isRead" : true, "email" : "demo@mymanager.com", "time" : "4/1/2023, 9:43:30 PM", "createdAt" : { "$date" : "2023-04-02T01:43:30.318+0000" }, "updatedAt" : { "$date" : "2023-04-28T12:20:39.720+0000" }, "__v" : 0 },
{ "_id" : { "$oid" : "642afd27da47f9dde768cdaa" }, "userId" : "6394e22877a382e42b5302a9", "uid" : "6417b914191f75863db02ce6", "textContent" : "Styling seems not good", "isSent" : true, "isSeen" : false, "isRead" : true, "email" : "demo@mymanager.com", "time" : "4/3/2023, 12:21:59 PM", "createdAt" : { "$date" : "2023-04-03T16:21:59.721+0000" }, "updatedAt" : { "$date" : "2023-04-28T12:20:39.720+0000" }, "__v" : 0 },
{ "_id" : { "$oid" : "642b23dbda47f9dde7690984" }, "userId" : "6394e22877a382e42b5302a9", "uid" : "63f6de5cbb79d4324b805cf1", "textContent" : "hi", "isSent" : true, "isSeen" : false, "isRead" : true, "email" : "xing.liao724@gmail.com", "time" : "4/3/2023, 3:07:07 PM", "createdAt" : { "$date" : "2023-04-03T19:07:07.179+0000" }, "updatedAt" : { "$date" : "2023-04-28T12:20:38.821+0000" }, "__v" : 0 },
{ "_id" : { "$oid" : "642b59748a61e0ca42b4fdb9" }, "userId" : "6394e22877a382e42b5302a9", "uid" : "63f6de5cbb79d4324b805cf1", "textContent" : "hello", "isSent" : true, "isSeen" : false, "isRead" : true, "email" : "xing.liao724@gmail.com", "time" : "4/3/2023, 6:55:48 PM", "createdAt" : { "$date" : "2023-04-03T22:55:48.400+0000" }, "updatedAt" : { "$date" : "2023-04-28T12:20:38.821+0000" }, "__v" : 0 },
{ "_id" : { "$oid" : "642cbc062906641394f7ddd4" }, "userId" : "6394e22877a382e42b5302a9", "uid" : "641c2868eea9f17fccbd8932", "textContent" : "HI This is tesst", "isSent" : true, "isSeen" : false, "isRead" : true, "email" : "test+90@mymanager.com", "time" : "4/4/2023, 8:08:38 PM", "createdAt" : { "$date" : "2023-04-05T00:08:38.643+0000" }, "updatedAt" : { "$date" : "2023-04-28T12:20:37.649+0000" }, "__v" : 0 },
{ "_id" : { "$oid" : "6449e45a9241ceaec6643f45" }, "userId" : "6394e22877a382e42b5302a9", "uid" : "63e675da120861af7aa7b35c", "textContent" : "?", "isSent" : true, "isSeen" : false, "isRead" : true, "email" : "uctmasterfrank@gmail.com", "time" : "4/26/2023, 10:56:26 PM", "createdAt" : { "$date" : "2023-04-27T02:56:26.419+0000" }, "updatedAt" : { "$date" : "2023-04-28T12:20:58.874+0000" }, "__v" : 0 },
{ "_id" : { "$oid" : "6449ebf2a11ef575822faa11" }, "userId" : "6394e22877a382e42b5302a9", "uid" : "63e675da120861af7aa7b35c", "textContent" : "Hello", "isSent" : false, "isSeen" : false, "isRead" : true, "email" : "uctmasterfrank@gmail.com", "time" : "4/26/2023, 11:28:50 PM", "createdAt" : { "$date" : "2023-04-27T03:28:50.467+0000" }, "updatedAt" : { "$date" : "2023-04-28T12:20:58.874+0000" }, "__v" : 0 },
{ "_id" : { "$oid" : "6449ec43a11ef575822fb208" }, "userId" : "6394e22877a382e42b5302a9", "uid" : "63e675da120861af7aa7b35c", "textContent" : "one two three", "isSent" : true, "isSeen" : false, "isRead" : true, "email" : "uctmasterfrank@gmail.com", "time" : "4/26/2023, 11:30:11 PM", "createdAt" : { "$date" : "2023-04-27T03:30:11.847+0000" }, "updatedAt" : { "$date" : "2023-04-28T12:20:58.874+0000" }, "__v" : 0 },
